"url","twitterUrl","id","text","retweetCount","replyCount","likeCount","quoteCount","createdAt","bookmarkCount","isRetweet","isQuote"
"https://x.com/ClauAker/status/1722113231055974725","https://twitter.com/ClauAker/status/1722113231055974725","1722113231055974725","Isso é muito doido! 
Acabei de ver em outro vídeo uma maluca usando uma faca 🔪 p descolar os posters, ela mais parecia uma psycho ! 
Essa daí nem sabe pq faz, mas diz que as fotos são fake, e isso em pleno 2023, com CHATGPT e Google 🤡! 
É um comportamento social estranho, para dizer o mínimo. Igual na época da COVID, que todo mundo resolveu estocar papel higiênico porque via outros comprando papel higiênico, e assim causaram um mega desabastecimento. Sério, isso merece estudo!","81","18","233","4","Wed Nov 08 04:46:04 +0000 2023","2","false","false"
"https://x.com/adorokuat/status/1722333498562712026","https://twitter.com/adorokuat/status/1722333498562712026","1722333498562712026","as vezes eu penso fodaseeeeeeee é so uma prova mas ai tipo eu lembro que tipo eu vo ser uma profissional pessima pq tudo que eu faço é em cima da hora usando chat gpt e querendo colar tipo para de ser assim vei https://t.co/68IOWWBmyQ","2","0","13","0","Wed Nov 08 19:21:20 +0000 2023","0","false","false"
"https://x.com/marceribas/status/1722261904553656378","https://twitter.com/marceribas/status/1722261904553656378","1722261904553656378","""a tecnologia vai dominar o mundo"" 
o chat gpt: https://t.co/UZ9pjqPW3r","1","0","13","0","Wed Nov 08 14:36:50 +0000 2023","0","false","false"
"https://x.com/IA_EXPLORADOR/status/1722261130452853239","https://twitter.com/IA_EXPLORADOR/status/1722261130452853239","1722261130452853239","@sama Muitas oportunidades para desenvolver para o ChatGPT agora mesmo.

Apps Shopify: 33.000 apps, $561M de receita
App Store: 1.8M apps, $910B de receita
ChatGPT Store: 0 ""agentes"", $0 de receita https://t.co/EbyoHthdNR","0","1","24","0","Wed Nov 08 14:33:46 +0000 2023","2","false","false"
"https://x.com/127praum/status/1722250542943187212","https://twitter.com/127praum/status/1722250542943187212","1722250542943187212","chatgpt caiu acabou o trabalho vou o casa https://t.co/TizoQ6hwIO","2","0","14","0","Wed Nov 08 13:51:41 +0000 2023","1","false","false"
"https://x.com/allanprinc3/status/1722264621242053114","https://twitter.com/allanprinc3/status/1722264621242053114","1722264621242053114","chat gpt fora do ar no dia da prova https://t.co/7uWn4yUknP","0","0","5","0","Wed Nov 08 14:47:38 +0000 2023","0","false","false"
"https://x.com/revistaforum/status/1722271215736520753","https://twitter.com/revistaforum/status/1722271215736520753","1722271215736520753","FORA DO AR

ChatGPT: usuários relatam problemas na plataforma de inteligência artificial

Chatbot não responde a comandos e informa que ""algo deu errado""; situação ocorre no Brasil e em diversos países

https://t.co/36URw4Dsha https://t.co/4BXekuBSsu","4","1","8","2","Wed Nov 08 15:13:50 +0000 2023","1","false","false"
"https://x.com/lorenzoridolfi/status/1722060695351501220","https://twitter.com/lorenzoridolfi/status/1722060695351501220","1722060695351501220","O ChatGPT acabou de sofrer um mega upgrade. Agora tem inúmeros chats especializados em vários assuntos e a consulta à Internet está inclusa, pelo menos no plano pago!
Revolucionário e assustador! https://t.co/Bth16gAkEw","4","2","28","0","Wed Nov 08 01:17:18 +0000 2023","1","false","false"
"https://x.com/humor_economico/status/1722231079346819104","https://twitter.com/humor_economico/status/1722231079346819104","1722231079346819104","Já pensou se daqui a 10 anos a moda é o ChatGPT implantado dentro do seu próprio cérebro? Conhecimento ilimitado sem precisar estudar?

Já vi isso em algum lugar. 🤔 https://t.co/e4ne6PfXgb","0","1","4","0","Wed Nov 08 12:34:21 +0000 2023","0","false","true"
"https://x.com/EliVieiraJr/status/1722262683486188029","https://twitter.com/EliVieiraJr/status/1722262683486188029","1722262683486188029","ChatGPT tá baleiando feio hoje. Não está respondendo prompt nenhum. https://t.co/j8wHlK2rsQ","0","4","25","1","Wed Nov 08 14:39:56 +0000 2023","0","false","false"
"https://x.com/artanjoz/status/1722263077872435477","https://twitter.com/artanjoz/status/1722263077872435477","1722263077872435477","o chat gpt caiu mds.
quero fazer meu tcc https://t.co/EvoA9BqV8b","2","5","67","0","Wed Nov 08 14:41:30 +0000 2023","4","false","false"
"https://x.com/novateceditora/status/1722250613877022917","https://twitter.com/novateceditora/status/1722250613877022917","1722250613877022917","Para desenvolvedores Python interessados em criar aplicativos com GPT-4 e ChatGPT, chegou o livro que faltava! Compre hoje mesmo com 25% off usando o Cód GPT no carrinho de compras em https://t.co/HzRc4aWyNY https://t.co/TePxOwBGTw","2","0","9","0","Wed Nov 08 13:51:58 +0000 2023","7","false","false"
"https://x.com/TechTudo/status/1722260457225158848","https://twitter.com/TechTudo/status/1722260457225158848","1722260457225158848","ChatGPT fora do ar hoje (8)? Usuários relatam problemas no chatbot https://t.co/OgtCT1WKkx https://t.co/xiMIaf2yhI","0","3","12","0","Wed Nov 08 14:31:05 +0000 2023","0","false","false"
"https://x.com/lorenzoridolfi/status/1722065757830250569","https://twitter.com/lorenzoridolfi/status/1722065757830250569","1722065757830250569","Dentre as novidades do upgrade do ChatGPT tem um sob medida para os esquerdistas portadores de tico e teco! https://t.co/PBvXzP0Iwq","1","1","9","0","Wed Nov 08 01:37:25 +0000 2023","0","false","false"
"https://x.com/saulo_oliveira/status/1722051067079254145","https://twitter.com/saulo_oliveira/status/1722051067079254145","1722051067079254145","Vou perguntar do chatgpt o que eu faço da minha vida. Pq eu sinceramente não sei mais","4","1","9","0","Wed Nov 08 00:39:03 +0000 2023","0","false","false"
"https://x.com/folhape/status/1722071445361070100","https://twitter.com/folhape/status/1722071445361070100","1722071445361070100","ChatGPT permitirá que usuário crie seu próprio chatbot - https://t.co/BEGkJbppy8 https://t.co/0XzLyO4l75","0","0","3","0","Wed Nov 08 02:00:01 +0000 2023","0","false","false"
"https://x.com/felipefialho_/status/1722218716459634758","https://twitter.com/felipefialho_/status/1722218716459634758","1722218716459634758","Vocês absorveram ferramentas de AI na rotina de vocês?

Uso o GitHub Copilot faz um bom tempo e com o modo chat ficou ainda mais útil. Chat GPT tenho usado menos mas funciona bem na maioria dos cenários que preciso

Não fazem milagres mas ajudam muito no dia a dia","4","31","93","1","Wed Nov 08 11:45:13 +0000 2023","13","false","false"
"https://x.com/_Nabarra/status/1722295630993731807","https://twitter.com/_Nabarra/status/1722295630993731807","1722295630993731807","Capaz de governar este país melhor do que qualquer partido era o ChatGPT.","4","2","15","0","Wed Nov 08 16:50:51 +0000 2023","0","false","false"
"https://x.com/isabelladias/status/1722350850994057419","https://twitter.com/isabelladias/status/1722350850994057419","1722350850994057419","acabei de apresentar um projeto pro freela que a mulher amou e simplesmente o chatgpt fez tudo por mim e eu só usei do meu carisma na apresentação obrigada tecnologia eu te amo","0","0","11","0","Wed Nov 08 20:30:17 +0000 2023","0","false","false"
"https://x.com/velhoprofessor/status/1722399912766128296","https://twitter.com/velhoprofessor/status/1722399912766128296","1722399912766128296","Participei de reunião ontem, num grupo SUPER ELITE DE SISTEMA ESCOLAR, cuja regra era: o importante é o acolhimento, o jovem se sentir seguro, “construir o conhecimento”, já que buscar informação é fácil com o chat GPT.
Só deixaram de fora neurociência e experiência da vida real.","23","3","139","0","Wed Nov 08 23:45:14 +0000 2023","4","false","true"
"https://x.com/tarciziosilva/status/1722268282215121154","https://twitter.com/tarciziosilva/status/1722268282215121154","1722268282215121154","Montando meu slideshow pra fala de amanhã no Seminário Inteligência Artificial em processos criativos no @cpfsesc . Bora?  Será na mesa Algoritmos, gêneros e racialidade na difusão artística"" com Fernanda Monteiro e Paola Barreto, mediação de Dulci Lima (@l_dulci) 

-> https://t.co/Mp3C5FSxNW","3","5","58","0","Wed Nov 08 15:02:11 +0000 2023","1","false","false"
"https://x.com/RadioeTVJustica/status/1722387701918294140","https://twitter.com/RadioeTVJustica/status/1722387701918294140","1722387701918294140","📺 @STF_oficial publica edital de chamamento público para conhecer projetos de soluções de inteligência artificial que permitam resumir processos judiciais preservando as informações principais. 
📡 #TVJustica https://t.co/KUjrwb2akd","3","0","4","0","Wed Nov 08 22:56:43 +0000 2023","0","false","false"
"https://x.com/helllobeautful/status/1722061348383666360","https://twitter.com/helllobeautful/status/1722061348383666360","1722061348383666360","caralho será que eles foram mesmo e se for tudo inteligência artificial https://t.co/mTlDnxLLOa","0","2","14","0","Wed Nov 08 01:19:54 +0000 2023","0","false","false"
"https://x.com/BandJornalismo/status/1722389705587585427","https://twitter.com/BandJornalismo/status/1722389705587585427","1722389705587585427","Estudiosos afirmam que a humanidade está diante de uma mudança grandiosa, equiparada a descoberta do fogo. Com tantas possibilidades, é bom ter pé no chão e saber utilizar as novas ferramentas da inteligência artificial. https://t.co/uxPtJuxoYW","1","0","9","1","Wed Nov 08 23:04:40 +0000 2023","0","false","false"
"https://x.com/STF_oficial/status/1722332583973781629","https://twitter.com/STF_oficial/status/1722332583973781629","1722332583973781629","➡️ @STF_oficial faz chamamento público para projetos de inteligência artificial que automatizem resumos de processos. Interessados têm até 13/11 para enviar propostas. O desenvolvimento dos protótipos não acarretará qualquer ônus ao Tribunal. Saiba mais: https://t.co/KHaKrmUZQY

#Acessibilidade #PraTodosVerem #PraCegoVer: esse post contém texto alternativo.","7","9","31","0","Wed Nov 08 19:17:42 +0000 2023","0","false","false"
"https://x.com/gothicszy/status/1722057320371220744","https://twitter.com/gothicszy/status/1722057320371220744","1722057320371220744","acho meio 🤨 essa briga por usar a mesma foto feita por inteligência artificial... tipo, vocês usam fotos repetidas quando são oficiais, qual é a diferença...?","0","4","12","0","Wed Nov 08 01:03:54 +0000 2023","0","false","false"
"https://x.com/jornal_cultura/status/1722057462113607919","https://twitter.com/jornal_cultura/status/1722057462113607919","1722057462113607919","""O que é crime na vida real, também é crime no mundo virtual.""

O professor de direito constitucional Oscar Vilhena explica ao #JC como crimes envolvendo Inteligência Artificial podem ser punidos.

#JornalDaCultura https://t.co/e7KRURsKG2","0","0","9","0","Wed Nov 08 01:04:27 +0000 2023","1","false","false"
"https://x.com/TechTudo/status/1722230274506031233","https://twitter.com/TechTudo/status/1722230274506031233","1722230274506031233","Inteligência Artificial no WhatsApp: conheça 3 chatbots para usar no app de mensagens https://t.co/WNagzfGgZw https://t.co/4cMJ3VhUus","1","0","5","0","Wed Nov 08 12:31:09 +0000 2023","1","false","false"
"https://x.com/g1/status/1722264460578992368","https://twitter.com/g1/status/1722264460578992368","1722264460578992368","#OAssunto - Por que os golpes que envolvem inteligência artificial, como falsos nudes, são tão perigosos? Para @brunnosarttori, a população precisa de educação digital. Ouça a conversa completa com @NatuzaNery https://t.co/GgfmDGD4zr #g1 https://t.co/ABKZ8NAqsi","7","3","62","1","Wed Nov 08 14:47:00 +0000 2023","0","false","false"
"https://x.com/lojaswift/status/1722259164544880718","https://twitter.com/lojaswift/status/1722259164544880718","1722259164544880718","amor, tá tudo bem? 
você nem tocou no seu pirata burger

*imagem feita com inteligência artificial* https://t.co/3cKwf7kbpQ","0","2","15","5","Wed Nov 08 14:25:57 +0000 2023","0","false","false"
"https://x.com/g1/status/1722343236944134266","https://twitter.com/g1/status/1722343236944134266","1722343236944134266","Como o surgimento de ferramentas simples de inteligência artificial abriram as portas para vários tipos de crimes, incluindo os falsos nudes? @NatuzaNery conversa com @brunnosarttori e com a advogada Patrícia Peck. OUÇA AGORA https://t.co/GgfmDGDCoZ #g1 https://t.co/bk0Sqb3Rim","1","6","46","1","Wed Nov 08 20:00:01 +0000 2023","2","false","false"
"https://x.com/melisfuracao/status/1722256737280086355","https://twitter.com/melisfuracao/status/1722256737280086355","1722256737280086355","eu quero todos os eletrosummer hits na voz da Rihanna por inteligência artificial fodase!!!! se um dia critiquei IA não me lembro 👍🏽","0","0","2","0","Wed Nov 08 14:16:18 +0000 2023","0","false","true"
"https://x.com/romanticmiles/status/1722219164730040646","https://twitter.com/romanticmiles/status/1722219164730040646","1722219164730040646","eu peço a criminalização da inteligência artificial","4","0","28","0","Wed Nov 08 11:47:00 +0000 2023","0","false","true"
"https://x.com/Lavits_/status/1722319767430693056","https://twitter.com/Lavits_/status/1722319767430693056","1722319767430693056","Fernanda Bruno participa amanhã (9/11) da mesa ""Mediação cultural e autonomia: implicações sobre a regulação do gosto"", no âmbito do seminário internacional ""Inteligência Artificial em processos criativos"", organizado pelo Sesc São Paulo. https://t.co/y1K1kuw2kZ","1","1","6","0","Wed Nov 08 18:26:46 +0000 2023","0","false","false"
"https://x.com/tonsdemim/status/1722198549599842619","https://twitter.com/tonsdemim/status/1722198549599842619","1722198549599842619","💡 Precisamos não apenas falar sobre, mas também fomentar um amplo debate popular sobre o Marco Legal da Inteligência Artificial no Brasil.

‼️ Você conhece o projeto de lei sobre o tema que está em curso no Congresso?

🟢 O PL 2338/2023, apresentado por Rodrigo Pacheco, incorporou ideias de quatro outros projetos anteriores e tem como elementos centrais “direitos fundamentais e a garantia da implementação de sistemas seguros e confiáveis em benefício da pessoa humana, do regime democrático e do desenvolvimento científico e tecnológico”.

➡️ O texto atual reflete anos de debates promovidos no Congresso, que contaram com a participação democrática a partir de consultas e audiências públicas, bem como a colaboração multissetorial e multidisciplinar.

✅ A ANPD já realizou dois estudos sobre o PL 2338/2023, dentre os quais está a análise publicada em outubro que apresenta contribuições concretas ao projeto de lei, além de um comparativo com experiências de regulação internacionais.

⚪ O projeto atual ainda está em construção e deve prosseguir em debate durante 2024. Precisamos nos comprometer com essa pauta e dar visibilidade a ela para ""evitarmos repetir com os mesmos erros cometidos no início da internet, com a falta de transparência e de regulação"".","11","1","38","0","Wed Nov 08 10:25:05 +0000 2023","5","false","false"
"https://x.com/GoalBR/status/1722261085871575299","https://twitter.com/GoalBR/status/1722261085871575299","1722261085871575299","Recriamos os escudos dos gigantes de Pernambuco e Bahia com ajuda de inteligência artificial! 🛡️ https://t.co/Ovr3wLhybo","2","5","25","1","Wed Nov 08 14:33:35 +0000 2023","0","false","false"
"https://x.com/cinepop/status/1722073064790213103","https://twitter.com/cinepop/status/1722073064790213103","1722073064790213103","Estúdios ACEITAM mudar as clausulas sobre inteligência artificial para encerrar a Greve dos Atores de Hollywood 

 https://t.co/EjT0nbUrut","1","0","11","0","Wed Nov 08 02:06:27 +0000 2023","2","false","false"
"https://x.com/dau_/status/1722346707986358290","https://twitter.com/dau_/status/1722346707986358290","1722346707986358290","amo a inteligência artificial que deixa todo mundo com o sotaque da gloria groove","0","0","6","0","Wed Nov 08 20:13:49 +0000 2023","0","false","true"
"https://x.com/arrooxa/status/1722267236654809420","https://twitter.com/arrooxa/status/1722267236654809420","1722267236654809420","instagram no futuro TEM QUE fazer uma inteligência artificial pra desativar o perfil dos recém-solteiros, tipo tirou 💍da bio ja toma block e fica 1 mêszinho sem usar essa porra, vai viver a vida","1","1","8","0","Wed Nov 08 14:58:02 +0000 2023","0","false","false"
"https://x.com/remendesss/status/1722328690703384754","https://twitter.com/remendesss/status/1722328690703384754","1722328690703384754","qual o nome da doença de quem posta foto de si mesmo feita por inteligência artificial no FEED do INSTAGRAM","1","3","6","0","Wed Nov 08 19:02:13 +0000 2023","0","false","false"
"https://x.com/jlameira/status/1722230797774753858","https://twitter.com/jlameira/status/1722230797774753858","1722230797774753858","@felipefialho_ Uma coisa que eu gosto do chatgpt é ele analisar meu código e sugerir alguma melhoria. Tipo clean  code ou alguma complexidade Algoritimica que pode ser melhorada.  Mas eu uso muito o Github copilot é uma mão na roda.","0","0","0","0","Wed Nov 08 12:33:14 +0000 2023","0","false","false"
"https://x.com/ElBetitoDev/status/1722265300979368390","https://twitter.com/ElBetitoDev/status/1722265300979368390","1722265300979368390","@felipefialho_ Usava o ChatGPT e o Copilot no dia a dia.  Mas a empresa bloqueou tudo (sim, bloquearam IA pro time de tecnologia...).
Agora tenho que escolher, ou aceito de cabeça baixa e fico pra trás, ou procuro outro emprego que não tenha essas limitações (censurado pelo jurídico).","0","1","1","0","Wed Nov 08 14:50:20 +0000 2023","0","false","false"
"https://x.com/HadesPlays_/status/1722265411801264534","https://twitter.com/HadesPlays_/status/1722265411801264534","1722265411801264534","Ja to imaginando a gente conectado por uma rede neural global em 2085 ansiosos pelo trailer de GTA VII 🤩","2","5","118","0","Wed Nov 08 14:50:46 +0000 2023","0","false","false"
"https://x.com/brenodeangelo/status/1722386196465107112","https://twitter.com/brenodeangelo/status/1722386196465107112","1722386196465107112","Pai tá MULTIDISCIPLINAR! De manhã aula de máquinas elétricas, de tarde tirar graxa de motor e de noite ver se a rede neural terminou de treinar","0","3","1","0","Wed Nov 08 22:50:44 +0000 2023","0","false","false"
"https://x.com/fbzll/status/1722351001460453412","https://twitter.com/fbzll/status/1722351001460453412","1722351001460453412","Assisti Megatubarão 2 e vsf como é bom ver filme ruim assim, sem pretensão nenhuma, sem qualquer resquício de compromisso com a verdade, sem precisar emitir qualquer sinapse na rede neural, da pra sentir o cérebro lisinho igual peito de frango","0","0","0","0","Wed Nov 08 20:30:53 +0000 2023","0","false","false"
"https://x.com/ideiasrevoltas/status/1722090344257331359","https://twitter.com/ideiasrevoltas/status/1722090344257331359","1722090344257331359","@VEJA Somos robôs, enganados numa rede neural poderosíssima !","0","0","0","0","Wed Nov 08 03:15:07 +0000 2023","0","false","false"
"https://x.com/gregoryzamir/status/1722070692596777444","https://twitter.com/gregoryzamir/status/1722070692596777444","1722070692596777444","Gemini Mom &amp; Leo Dad","0","0","0","0","Wed Nov 08 01:57:02 +0000 2023","0","false","true"
"https://x.com/reebezzyy/status/1722310412681801937","https://twitter.com/reebezzyy/status/1722310412681801937","1722310412681801937","geminis 🔛🔝","0","0","1","0","Wed Nov 08 17:49:36 +0000 2023","0","false","true"
"https://x.com/makimamiilf/status/1722390393822552146","https://twitter.com/makimamiilf/status/1722390393822552146","1722390393822552146","geminis","0","0","1","0","Wed Nov 08 23:07:25 +0000 2023","0","false","false"
"https://x.com/PhuwinBrasil/status/1722147937327738988","https://twitter.com/PhuwinBrasil/status/1722147937327738988","1722147937327738988","#TRAD | O feedback sobre Kul

Gemini: O personagem de Kul me interessou muito, Phuwin providenciou para transmiti-lo tão bem

#phuwintang #Gemini_NT #markpakin #GMMTVLiveHouse #WednesdayClubEP1
https://t.co/54nDk6DYUU","0","1","1","0","Wed Nov 08 07:03:58 +0000 2023","0","false","false"
"https://x.com/emkt_terrivel/status/1722238004511817965","https://twitter.com/emkt_terrivel/status/1722238004511817965","1722238004511817965","São 23.000 lux de saída bruta a 3 m/10 pés de um painel de 500 W criam um novo mundo de opções. 
Gemini 2x1 Hard muda de um feixe intenso de 20° para uma luz suave e envolvente com difusores incluídos na caixa e ainda oferece espaço para muito mais camadas. #gemini #litepanels https://t.co/r9D1p6K87j","0","0","0","0","Wed Nov 08 13:01:52 +0000 2023","0","false","false"
"https://x.com/HalleChanell/status/1722117991716778410","https://twitter.com/HalleChanell/status/1722117991716778410","1722117991716778410","Capricorn mom
Gemini dad","0","0","1","0","Wed Nov 08 05:04:59 +0000 2023","0","false","true"
"https://x.com/anemaria1129/status/1722389916485660718","https://twitter.com/anemaria1129/status/1722389916485660718","1722389916485660718","O Gemini é uma figura... Oh pequeno ligado nos 220...","0","0","7","0","Wed Nov 08 23:05:31 +0000 2023","0","false","true"
"https://x.com/yannanajae/status/1722263378952122836","https://twitter.com/yannanajae/status/1722263378952122836","1722263378952122836","Virgo &amp; Leo, Im A Gemini","0","0","1","0","Wed Nov 08 14:42:42 +0000 2023","0","false","true"
"https://x.com/mamimoneygang/status/1722290953333977164","https://twitter.com/mamimoneygang/status/1722290953333977164","1722290953333977164","a Gemini queen 💅🏽","0","1","2","0","Wed Nov 08 16:32:16 +0000 2023","0","false","true"
"https://x.com/conejitacorazon/status/1722053600426270903","https://twitter.com/conejitacorazon/status/1722053600426270903","1722053600426270903","i lurvvvvv geminis aquarians n leos","0","2","2","0","Wed Nov 08 00:49:07 +0000 2023","0","false","true"
"https://x.com/1kittybook/status/1722255328635703454","https://twitter.com/1kittybook/status/1722255328635703454","1722255328635703454","Até hoje eu fico impressionada com o gemini não se assustando com o estouro dos fogos em moonlight chicken
Porque é muito difícil, é automático, e você sabendo fica mais difícil ainda","0","0","2","0","Wed Nov 08 14:10:42 +0000 2023","0","false","true"
"https://x.com/SadityBombshell/status/1722259752544247909","https://twitter.com/SadityBombshell/status/1722259752544247909","1722259752544247909","Me as a Gemini.","0","0","1","0","Wed Nov 08 14:28:17 +0000 2023","0","false","true"
"https://x.com/riboismm/status/1722101792962425137","https://twitter.com/riboismm/status/1722101792962425137","1722101792962425137","geminis 🔛🔝","3","4","24","0","Wed Nov 08 04:00:37 +0000 2023","0","false","true"
"https://x.com/shatteredxlovex/status/1722336322080195048","https://twitter.com/shatteredxlovex/status/1722336322080195048","1722336322080195048","pisces mom &amp; gemini dad","0","0","1","0","Wed Nov 08 19:32:33 +0000 2023","0","false","true"
"https://x.com/ModularCrypto/status/1722214999173874123","https://twitter.com/ModularCrypto/status/1722214999173874123","1722214999173874123","🇬🇧 Adequando às novas regras.
A Gemini no Reino Unido limitará as transferências de criptomoedas.","0","1","3","0","Wed Nov 08 11:30:27 +0000 2023","0","false","true"
"https://x.com/posterboywill/status/1722337700068421642","https://twitter.com/posterboywill/status/1722337700068421642","1722337700068421642","Leo
Leo 
Leo 
Leo 
Gemini","1","3","1","0","Wed Nov 08 19:38:01 +0000 2023","0","false","true"
"https://x.com/dprGgG/status/1722224696459182370","https://twitter.com/dprGgG/status/1722224696459182370","1722224696459182370","Gemini ganha por MT pouco","0","1","1","0","Wed Nov 08 12:08:59 +0000 2023","0","false","true"
"https://x.com/DanielR17628392/status/1722066177923432841","https://twitter.com/DanielR17628392/status/1722066177923432841","1722066177923432841","Para ganhar criptomoedas, cadastre-se na Gemini e negocie pelo menos $100. Quanto mais você negociar, mais você e seu amigo ganham!
https://t.co/wV0pJamulp https://t.co/wV0pJamulp","0","0","0","0","Wed Nov 08 01:39:05 +0000 2023","0","false","false"
"https://x.com/cmdarwindavid/status/1722374351645814913","https://twitter.com/cmdarwindavid/status/1722374351645814913","1722374351645814913","@Luishrnandez Geminis https://t.co/0oYzEUmyTm","0","1","3","0","Wed Nov 08 22:03:40 +0000 2023","1","false","false"
"https://x.com/kittenwt/status/1722068761883058416","https://twitter.com/kittenwt/status/1722068761883058416","1722068761883058416","que essa seja a primeira e última vez que veremos o gemini chorando em uma cena plmds eu não aguento meu coração dói","0","0","0","0","Wed Nov 08 01:49:21 +0000 2023","0","false","true"
"https://x.com/MBITSchool/status/1722190502890500390","https://twitter.com/MBITSchool/status/1722190502890500390","1722190502890500390","👉Únete a MBIT DATA School para aprender sobre la cultura de ciencia de datos e IA: https://t.co/jXrZrZPec8

#MachineLearning #CienciaDeDatos #IA #Tecnología #MBITDATASchool","0","0","0","0","Wed Nov 08 09:53:07 +0000 2023","0","false","false"
"https://x.com/ninadhora/status/1722401396039815253","https://twitter.com/ninadhora/status/1722401396039815253","1722401396039815253","7 horas da manhã no Brasil e 11 horas na universidade Paris 1 Panthéon Sorbonne pra compartilhar e e ouvir sobre lentes diferentes de IA, regulação e América Latina. Evento Academic Days on Open Government and Digital Issues IMODEV https://t.co/6ZCspV6t53","5","1","103","0","Wed Nov 08 23:51:08 +0000 2023","2","false","false"
