"url","twitterUrl","id","text","retweetCount","replyCount","likeCount","quoteCount","createdAt","bookmarkCount","isRetweet","isQuote"
"https://x.com/PrJosiasPereir3/status/1732222007020789900","https://twitter.com/PrJosiasPereir3/status/1732222007020789900","1732222007020789900","Moraes afirma que 'extrema direita' usa inteligência artificial de forma maléfica para conquistar o poder
Para ele o uso da IA no contexto político pode ampliar o alcance e o convencimento de eleitores através da desinformação
Punições, como cassação de candidaturas e de mandatos https://t.co/A2LKkKKxBS","14","24","97","4","Wed Dec 06 02:14:44 +0000 2023","0","false","false"
"https://x.com/galvaonavoz/status/1732246320931393868","https://twitter.com/galvaonavoz/status/1732246320931393868","1732246320931393868","Tenho um novo vício pra fugir da insônia e esse vício consiste em criar imagens totalmente aleatórias pela inteligência artificial .

Apresento pra vocês um casal de capivaras ensaiando uma coreografia de forró enquanto um meteoro se aproxima 🥰🥰🥰🥰 https://t.co/IoZjRZvD4U","0","0","3","0","Wed Dec 06 03:51:21 +0000 2023","0","false","false"
"https://x.com/Whiplash_Net/status/1732433234322227307","https://twitter.com/Whiplash_Net/status/1732433234322227307","1732433234322227307","Ozzy surpreende ao falar sobre uso de Inteligência Artificial na música https://t.co/w6tyxZGM1h  https://t.co/CijcXm5Uru https://t.co/LIIl1n2AqQ","2","0","9","0","Wed Dec 06 16:14:04 +0000 2023","0","false","false"
"https://x.com/jonghyunwfk/status/1732212413611557219","https://twitter.com/jonghyunwfk/status/1732212413611557219","1732212413611557219","acabei de descobrir q existe um app onde vc pode ""criar"" um contato com o nome de um fav ou algo assim e a inteligência artificial conversa com vc como si fosse aquela pessoa, usando hábitos e costumes da pessoa, tô em choque https://t.co/DZWOW8qSVT","0","3","6","0","Wed Dec 06 01:36:37 +0000 2023","2","false","false"
"https://x.com/bgodinho/status/1732226334640734302","https://twitter.com/bgodinho/status/1732226334640734302","1732226334640734302","Não pode ser coincidência que a inteligência artificial está ganhando espaço bem quando a ignorância das pessoas parece estar no seu auge.","0","0","7","0","Wed Dec 06 02:31:56 +0000 2023","0","false","false"
"https://x.com/wagrods/status/1732437124174287221","https://twitter.com/wagrods/status/1732437124174287221","1732437124174287221","O Perdido é genial demais! 

A bricolagem que ele faz em uma mescla de linguagens utilizando recursos analógicos uma câmera digital da década de 90 e ainda personagens gerados por Inteligência Artificial...ficou sensacional d+!!! 

D I V O 

https://t.co/6QRq3EwIOn","1","2","7","0","Wed Dec 06 16:29:32 +0000 2023","1","false","false"
"https://x.com/CNNEconomia/status/1732402463532347724","https://twitter.com/CNNEconomia/status/1732402463532347724","1732402463532347724","Sam Altman, da OpenAI, é eleito CEO do ano pela Time

https://t.co/5VqBqbOKHr","1","1","10","0","Wed Dec 06 14:11:48 +0000 2023","0","false","false"
"https://x.com/T2iD_/status/1732465065151054284","https://twitter.com/T2iD_/status/1732465065151054284","1732465065151054284","Google lança Gemini, seu ‘modelo de IA mais novo e mais capaz’ – e um ataque frontal total ao GPT-4 da OpenAI https://t.co/FNvKgbrMtn #Notícias #ataque #capaz #frontal #Gemini","0","0","0","0","Wed Dec 06 18:20:33 +0000 2023","0","false","false"
"https://x.com/gft_br/status/1732375877017604210","https://twitter.com/gft_br/status/1732375877017604210","1732375877017604210","Já faz um ano que a OpenAI lançou o ChatGPT. Trata-se de um assistente virtual que utiliza IA para interagir e fornecer suporte em uma ampla variedade de tarefas e contextos.

Quais são os principais benefícios da utilização do ChatGPT?

#GFTBrasil #ChatGPT #EnqueteGFT","0","0","4","0","Wed Dec 06 12:26:09 +0000 2023","0","false","false"
"https://x.com/debrathomaz/status/1732419538288021715","https://twitter.com/debrathomaz/status/1732419538288021715","1732419538288021715","Criei um projeto de bot com o GPT usando a API da OpenAI, pra no fim das contas eles não me deixarem usar a API de graça 🤡","0","0","0","0","Wed Dec 06 15:19:39 +0000 2023","0","false","false"
"https://x.com/claudia_carla/status/1732396301038293337","https://twitter.com/claudia_carla/status/1732396301038293337","1732396301038293337","Gostei muito deste artigo, escrito pelo Glauco Arbix explicando as idas e vindas do Conselho da OpenAI e suas consequências para a inteligência artificial!

https://t.co/hZRlVwryPs","0","0","0","0","Wed Dec 06 13:47:19 +0000 2023","0","false","false"
"https://x.com/gabriel202210/status/1732545917163548815","https://twitter.com/gabriel202210/status/1732545917163548815","1732545917163548815","O Google lançou nesta quarta-feira sua nova inteligência artificial: o Google Gemini, que é rival do C h a t GPT, da Openai. É a segunda ia do Google, a primeira é o Bard, lançado no ínicio de 2023.","0","0","0","0","Wed Dec 06 23:41:50 +0000 2023","0","false","false"
"https://x.com/josuedeOliv/status/1732373827408040122","https://twitter.com/josuedeOliv/status/1732373827408040122","1732373827408040122","Rolaram uns rumores de que a OpenAI teria desenvolvido uma IA que aprendeu coisas de forma autônoma. Nada confirmado, mas e se? Seria esse o marco zero da inteligência artificial geral? Discutimos sobre no Tecnocast da semana. https://t.co/3oyGU5jZq2","0","0","1","0","Wed Dec 06 12:18:01 +0000 2023","0","false","false"
"https://x.com/giovannibassi/status/1732438452233257459","https://twitter.com/giovannibassi/status/1732438452233257459","1732438452233257459","Tenho lido várias fofocas e boatos sobre a treta da demissão do CEO da OpenAI, e uma das mais interessantes é a reação da Microsoft. Somando isso a todo o foco que eles tem colocado em IA tanto no Azure quanto nos copilotos (Windows, Bing, Github, Office etc) dá pra ter uma boa dimensão da importância da IA no negócio deles.
Me fica a impressão de que eles encontraram uma oportunidade única, dessas que aparece a cada dez anos ou mais. Eles parecem estar tratando isso com a importância que o iPhone teve (e tem) pra Apple: algo que muda tudo, aumenta sua lucratividade e seu lucro, te reposiciona enquanto empresa, e alavanca todos os seus outros negócios.

Desde o surgimento do smartphone temos visto todo mundo procurando a próxima grande tecnologia, e, por pura falta de criatividade, olhando em torno dos dispositivos pessoais; daí o foco em Metaverso (!?!?), realidade virtual e aumentada, smartwatches (smart-tudo) etc.
Mas a próxima grande inovação veio de um campo completamente desconectado da anterior.

Não adianta procurar no mesmo lugar. Inovação é como uma b0mba nucl€ar, ela tem o impacto inicial mais forte, daí vem os impactos secundários e depois vêm os efeitos de longo prazo. Mas as outras vão cair em outro lugar, não ao lado da primeira, ou seja: não adianta tentar descobrir onde o próximo grande impacto será tentando surfar em impactos secundários. 

E a gente ainda nem terminou de vivenciar o impacto inicial, ele ainda está em elaboração. De novo dá pra olhar pro iPhone, que só foi realizar um dos seus grandes impactos, a loja, depois de uns anos.

Isso faz entender perfeitamente os boatos sobre a reação da Microsoft, profundamente irritada com a treta da OpenAI: isso poderia, se mal gerenciado, diminuir muito sua participação em algo com esse potencial gigantesco. Mesmo depois de, desta vez, terem feito a lição de casa e não terem chegado atrasados no jogo - dizendo coisas como ""ninguém vai querer um telefone sem teclado de 500 dólares"".

O próximo ano vai ser muito interessante, vem muita coisa legal por aí, a quantidade de capital sendo colocada nesse campo segue aumentando vertiginosamente, e muita gente vai ter a chance de falhar miseravelmente. Quem será o próximo Windows Phone? Qual será a próxima loja? Quais serão os impactos secundários e de longo prazo?","7","7","78","0","Wed Dec 06 16:34:48 +0000 2023","5","false","false"
"https://x.com/aaronjcash/status/1732474236172988811","https://twitter.com/aaronjcash/status/1732474236172988811","1732474236172988811","@unusual_whales OpenAI response https://t.co/dkX8RTxNDw","0","0","0","0","Wed Dec 06 18:57:00 +0000 2023","0","false","false"
"https://x.com/lemos_ronaldo/status/1732334716815098091","https://twitter.com/lemos_ronaldo/status/1732334716815098091","1732334716815098091","Por seis anos fiz parte do conselho da @mozilla que faz o Firefox. Em entrevista para a revista @WIRED falei como a Mozilla é um exemplo de sucesso em alinhar interesse público sem fins lucrativos e atividades econômicas. A OpenAI poderia seguir o exemplo.
https://t.co/P80NeNQ6Kp","9","1","82","0","Wed Dec 06 09:42:36 +0000 2023","4","false","false"
"https://x.com/kkurarukas/status/1732509621359649185","https://twitter.com/kkurarukas/status/1732509621359649185","1732509621359649185","e aí openai e microsoft?","0","0","0","0","Wed Dec 06 21:17:36 +0000 2023","0","false","true"
"https://x.com/rapozawa/status/1732459681149309423","https://twitter.com/rapozawa/status/1732459681149309423","1732459681149309423","Google trazendo competição para a OpenAI, entregando até mesmo uma versão Nano que rodará localmente nos aparelhos Google Pixel 8 Pro.

#IA #AI 

https://t.co/fCfEZ7oDYV","0","0","0","0","Wed Dec 06 17:59:10 +0000 2023","0","false","false"
"https://x.com/Estadao/status/1732506448096072074","https://twitter.com/Estadao/status/1732506448096072074","1732506448096072074","FUNDADOR DA OPENAI

Sam Altman é eleito CEO do ano pela revista Time; relembre sua atuação em IA (via @EstadaoLink) 

https://t.co/2FT6WMIb1L","2","0","7","0","Wed Dec 06 21:05:00 +0000 2023","0","false","false"
"https://x.com/epocanegocios/status/1732379394180526120","https://twitter.com/epocanegocios/status/1732379394180526120","1732379394180526120","A empresa, que lançou há poucos meses o chatbot Grok, quer bater de frente com rivais como a OpenAI

https://t.co/1iYfRfHGL9","0","0","2","0","Wed Dec 06 12:40:08 +0000 2023","0","false","false"
"https://x.com/JoseRob56701007/status/1732378017735881202","https://twitter.com/JoseRob56701007/status/1732378017735881202","1732378017735881202","Leitura imperdível, esta do @garbix . A crise da OpenAI, a dança das versões e o distanciamento do público https://t.co/dg0npxP2Cz via @usponline","0","0","0","0","Wed Dec 06 12:34:40 +0000 2023","0","false","false"
"https://x.com/canaltech/status/1732396942896881736","https://twitter.com/canaltech/status/1732396942896881736","1732396942896881736","IA Copilot do Windows vai receber melhorias a partir da integração com modelos GPT-4 Turbo, da OpenAI, e DALL-E 3, para geração de imagens https://t.co/h2vuTp6eL7","0","0","6","0","Wed Dec 06 13:49:52 +0000 2023","0","false","false"
"https://x.com/BenSyne/status/1732546532648325301","https://twitter.com/BenSyne/status/1732546532648325301","1732546532648325301","@Jason @Google @OpenAI O man, LFG🚀","0","0","0","0","Wed Dec 06 23:44:17 +0000 2023","0","false","false"
"https://x.com/OGlobo_Economia/status/1732384001296409045","https://twitter.com/OGlobo_Economia/status/1732384001296409045","1732384001296409045","'Barbie' e Taylor Swift fora do top 10: Wikipedia revela páginas mais acessadas em 2023. Ferramenta de inteligência artificial da OpenAI, ChatGPT lidera ranking.
https://t.co/Gsjl8JRhfT","0","0","0","0","Wed Dec 06 12:58:26 +0000 2023","0","false","false"
"https://x.com/mindtekbr/status/1732390003710243019","https://twitter.com/mindtekbr/status/1732390003710243019","1732390003710243019","Confira os destaques do Update do Qlik Sense

📌 Chatbot personalizado com OpenAI
📌 Nova extensão: Objeto de texto
📌 Nova função: Usuário de análises incorporadas
📌 Suporte expandido para conexões privadas e entre outros...

https://t.co/jr8Rq1Pm6Y @qlik #bolhadev","1","0","3","1","Wed Dec 06 13:22:17 +0000 2023","0","false","false"
"https://x.com/BotDeschamps/status/1732410021068378293","https://twitter.com/BotDeschamps/status/1732410021068378293","1732410021068378293","Meta, IBM, Intel, AMD, NASA, CERN e 55 outras organizações formam  a “AI Alliance”, visando promover a inovação aberta em IA: a  iniciativa se contrapõe a sistemas de IA fechados, como os da  OpenAI e Google, enfatizando a transparência e o compartilhamento  de pesquisas e","0","1","1","0","Wed Dec 06 14:41:50 +0000 2023","0","false","false"
"https://x.com/esoteric_wwc/status/1732381567681438140","https://twitter.com/esoteric_wwc/status/1732381567681438140","1732381567681438140","Popo team geminis martial arts and taekwondo athletes 🥰","0","0","1","0","Wed Dec 06 12:48:46 +0000 2023","0","false","true"
"https://x.com/TechTudo/status/1732457783860359532","https://twitter.com/TechTudo/status/1732457783860359532","1732457783860359532","Gemini é lançado: tudo que você precisa saber sobre a nova IA do Google https://t.co/BCvwZXYXk0 https://t.co/8ZzeJjzTbH","1","0","4","0","Wed Dec 06 17:51:37 +0000 2023","2","false","false"
"https://x.com/BrasilCloser/status/1732518620192792850","https://twitter.com/BrasilCloser/status/1732518620192792850","1732518620192792850","🚀 Mergulhe no futuro com o Google Gemini! Confira Confira esse vídeo que dublamos usando a @speechlab_ai e descubra como essa tecnologia revolucionária está redefinindo o possível. Prepare-se para ficar impressionado! #InovaçãoGoogle #GeminiEmAção https://t.co/bV7vA45kBI","21","2","53","10","Wed Dec 06 21:53:22 +0000 2023","24","false","false"
"https://x.com/CH3W_Y/status/1732274619720376534","https://twitter.com/CH3W_Y/status/1732274619720376534","1732274619720376534","Gemini é uma criança gigante 🥹🫶🏼","0","0","4","0","Wed Dec 06 05:43:48 +0000 2023","0","false","true"
"https://x.com/amandamaqes/status/1732485309625950700","https://twitter.com/amandamaqes/status/1732485309625950700","1732485309625950700","Lançaram a Gemini, novo modelo de IA que promete ter um desempenho melhor que o GPT (usado pelo ChatGPT)… 

O Gemini Pro será adicionado ao Bard a partir de hoje e já quero saber como vai ser essa mudança 👀","0","0","1","0","Wed Dec 06 19:41:00 +0000 2023","0","false","true"
"https://x.com/runixo/status/1732490687961088171","https://twitter.com/runixo/status/1732490687961088171","1732490687961088171","@sundarpichai @solsona sos pésimo gemini https://t.co/zYTfUYG8k8","1","0","4","1","Wed Dec 06 20:02:22 +0000 2023","0","false","false"
"https://x.com/vitordornelles/status/1732468678967308695","https://twitter.com/vitordornelles/status/1732468678967308695","1732468678967308695","Google Bard (teoricamente já usando o recém-lançado Gemini) versus o GPT 4, descrevendo a mesma imagem. Bard ainda precisa avançar um bocado. https://t.co/ODcW1nMTlo","1","0","2","0","Wed Dec 06 18:34:55 +0000 2023","0","false","false"
"https://x.com/ECO_PT/status/1732480459542602160","https://twitter.com/ECO_PT/status/1732480459542602160","1732480459542602160","Google lança o Gemini, o rival do ChatGPT https://t.co/sxliB6dNUC https://t.co/l1LLdQEyqL","4","0","3","0","Wed Dec 06 19:21:44 +0000 2023","0","false","false"
"https://x.com/deOliveiraDi/status/1732486605410046154","https://twitter.com/deOliveiraDi/status/1732486605410046154","1732486605410046154","olha a naturalidade da conversa do Gemini. que loucura!","0","0","1","0","Wed Dec 06 19:46:09 +0000 2023","0","false","true"
"https://x.com/lucas_montano/status/1732519543283580950","https://twitter.com/lucas_montano/status/1732519543283580950","1732519543283580950","GPU vs. TPU 🔥

Gemini se provando uma IA superior ao GPT vai também impactar a NVIDIA

Google não só pode surpreender na aplicação dessa IA mas nos recursos computacionais necessários pra fazer ela acontecer","6","8","149","0","Wed Dec 06 21:57:02 +0000 2023","11","false","true"
"https://x.com/revistaoeste/status/1732481031679209702","https://twitter.com/revistaoeste/status/1732481031679209702","1732481031679209702","Google lança seu maior modelo de inteligência artificial: o Gemini https://t.co/J9KdXhO0zL","22","2","85","1","Wed Dec 06 19:24:00 +0000 2023","0","false","false"
"https://x.com/WssupDock/status/1732538661886202167","https://twitter.com/WssupDock/status/1732538661886202167","1732538661886202167","$GEMINI AI

https://t.co/QQOkGvtQcR
https://t.co/kRNYIvdGcc
https://t.co/DpqGXYCKjc

Official CA: 0xB954562066c71b3E6e7b2ac330B03C74c0Dcd5AE","4","1","12","0","Wed Dec 06 23:13:00 +0000 2023","1","false","false"
"https://x.com/OGlobo_Economia/status/1732433195751161999","https://twitter.com/OGlobo_Economia/status/1732433195751161999","1732433195751161999","Google lança Gemini, inteligência artificial para rivalizar com o ChatGPT. No Brasil, ferramenta Bard ganha versão mais poderosa de IA para textos, mas por enquanto só em inglês. Saiba tudo.
https://t.co/BQa0kkeNAv","2","0","2","0","Wed Dec 06 16:13:55 +0000 2023","0","false","false"
"https://x.com/folhape/status/1732493865284931768","https://twitter.com/folhape/status/1732493865284931768","1732493865284931768","Google lança Gemini, inteligência artificial para rivalizar com o ChatGPT; saiba tudo - https://t.co/Yr3wu0YIqI https://t.co/xK6FyJJzKt","0","0","2","0","Wed Dec 06 20:15:00 +0000 2023","0","false","false"
"https://x.com/ReneFraga/status/1732445996200714281","https://twitter.com/ReneFraga/status/1732445996200714281","1732445996200714281","Google anuncia Gemini: seu maior e mais capaz modelo de IA

https://t.co/0TRycg9qAQ","1","4","3","1","Wed Dec 06 17:04:47 +0000 2023","1","false","false"
"https://x.com/babbiibabe/status/1732374172163330264","https://twitter.com/babbiibabe/status/1732374172163330264","1732374172163330264","sabe aquela historia do que se apaixona primeiro e do que se apaixona mais??? o gemini sabe que vai ser o que vai se apaixonar mais então ele ta se segurando ao maximo kkkkkkkkkk","1","2","3","0","Wed Dec 06 12:19:23 +0000 2023","0","false","true"
"https://x.com/CNNEconomia/status/1732500337972449494","https://twitter.com/CNNEconomia/status/1732500337972449494","1732500337972449494","Google lança Gemini, plataforma de IA para competir com ChatGPT; entenda
https://t.co/JIJxU44aRV","4","2","12","1","Wed Dec 06 20:40:43 +0000 2023","1","false","false"
"https://x.com/Metropoles/status/1732436238051786873","https://twitter.com/Metropoles/status/1732436238051786873","1732436238051786873","➡️ Google lança Gemini, sistema de IA mais potente; veja como funciona.

Gemini poderá ser testado no Google Bard, chatbot de IA criado pela companhia para concorrer com o ChatGPT, da OpenAI.

Leia: https://t.co/JqP2GLcmEw https://t.co/8tYnLpbPac","2","0","12","0","Wed Dec 06 16:26:00 +0000 2023","0","false","false"
"https://x.com/willncti/status/1732504346443588022","https://twitter.com/willncti/status/1732504346443588022","1732504346443588022","o gemini está incrível, vai vir pra solar o chat gpt","0","1","2","0","Wed Dec 06 20:56:39 +0000 2023","0","false","false"
"https://x.com/sbtnews/status/1732521479852511489","https://twitter.com/sbtnews/status/1732521479852511489","1732521479852511489","Contra ChatGPT, Google anuncia a inteligência artificial Gemini #sbtnews  https://t.co/2vkV02HDtQ https://t.co/8xS6RoqEb7","0","0","4","0","Wed Dec 06 22:04:44 +0000 2023","0","false","false"
"https://x.com/Prodigiosn/status/1732550232762675469","https://twitter.com/Prodigiosn/status/1732550232762675469","1732550232762675469","Se não recebeste uma chamada minha a avisar que eu ia começar um negócio com o fulano, não vais receber uma chamada minha a explicar que o negócio correu mal e o fulano é assado ou cozido!","37","3","221","1","Wed Dec 06 23:58:59 +0000 2023","2","false","false"
"https://x.com/ProsperaPispol/status/1732549349081596055","https://twitter.com/ProsperaPispol/status/1732549349081596055","1732549349081596055","Se eu não morasse  no Rj eu ia achar  que era ko as coisas que acontece nesse lugar....","9","0","70","1","Wed Dec 06 23:55:28 +0000 2023","1","false","false"
"https://x.com/IamKiannzz/status/1732545553194520679","https://twitter.com/IamKiannzz/status/1732545553194520679","1732545553194520679","Boa noite fãs de #QSMP
Querem participar de um SMP Mobile e PC com temática de Apocalipse Zumbi?
Pois bem, então conheça o IAASMP (O IA NÃO É DE INTELIGÊNCIA ARTIFICIAL!!!!!!!) aqui nós temos um mundo com temática Pós-Apocalíptica, com diferentes Comunidades/Grupos, que estão https://t.co/YvAUFwEghQ","2","5","5","1","Wed Dec 06 23:40:23 +0000 2023","1","false","false"
"https://x.com/paulobin/status/1732544713574564340","https://twitter.com/paulobin/status/1732544713574564340","1732544713574564340","momentos raros registrado: eu chorando
(eu bebado chorando pós bloquinho de carnaval pq o @ale_rrandro ia embora para o Japão e o @avematheus pra Irlanda) https://t.co/uIktBrCPxe","0","3","8","0","Wed Dec 06 23:37:03 +0000 2023","0","false","false"
"https://x.com/Nickmikaelly/status/1732548264925302967","https://twitter.com/Nickmikaelly/status/1732548264925302967","1732548264925302967","Arthur ia ficar um 🐈 ainda mas se lançasse um pretinho no cabelo 💘","2","0","5","0","Wed Dec 06 23:51:10 +0000 2023","0","false","true"
"https://x.com/kicodes/status/1732549269431681200","https://twitter.com/kicodes/status/1732549269431681200","1732549269431681200","""se o roier estivesse aq ele ia ter achado mt foda"" PAREM DE SEPARAR O LATINOTRIO","3","1","31","0","Wed Dec 06 23:55:09 +0000 2023","0","false","false"
"https://x.com/pastequemille/status/1732546054317306157","https://twitter.com/pastequemille/status/1732546054317306157","1732546054317306157","ENQUANTO A HILDA IA SE DESPINDO E ANDANDO, ELA OLHAVA DIRETAMENTE NOS OLHOS DO MALTHUS, DIFERENTE DE QUANDO ELA ESTAVA PRESTES A TRANSAR COM UM CLIENTE.
PARA OS CLIENTES ELA TIRAVA A ROUPA DE COSTAS, MAS PRO MALTHUS ELA OLHOU NO FUNDO DA ALMA DELE DO INÍCIO AO FIM.
CINEMA TÁ?","3","0","20","0","Wed Dec 06 23:42:23 +0000 2023","5","false","true"
"https://x.com/BangaLost/status/1732546863411114455","https://twitter.com/BangaLost/status/1732546863411114455","1732546863411114455","Família @ondebagacar junto com @brenodaempada meteram um sorteio lá no Instagram ""famoso empadadate"" se eu fosse vocês não ia perder por nada,vou até deixar o link aqui 👇🏽

https://t.co/4BQMC4DDZO","5","0","8","0","Wed Dec 06 23:45:36 +0000 2023","0","false","false"
"https://x.com/lyviacrf/status/1732548243832057864","https://twitter.com/lyviacrf/status/1732548243832057864","1732548243832057864","Thaissa toda semana vai no mundial ou no assai, ia ser justo uma parceria kkkkkkkkkkkkkkk","1","1","2","0","Wed Dec 06 23:51:05 +0000 2023","0","false","false"
"https://x.com/mundosdacarol/status/1732545014562017418","https://twitter.com/mundosdacarol/status/1732545014562017418","1732545014562017418","É, claro, que ela ia ficar rodeada de abelhinhas…ela é nosso favinho de mel😍🩵","3","0","33","0","Wed Dec 06 23:38:15 +0000 2023","0","false","true"
"https://x.com/Demonioceleste/status/1732544459215167762","https://twitter.com/Demonioceleste/status/1732544459215167762","1732544459215167762","ainda bem que o cruzeiro se salvou na última rodada, nessa rodada com 9 jogos ao mesmo tempo a cada bolinha na globo ia ser um surto","3","1","44","0","Wed Dec 06 23:36:02 +0000 2023","0","false","false"
"https://x.com/monarcaPTista/status/1732546190183387417","https://twitter.com/monarcaPTista/status/1732546190183387417","1732546190183387417","Nunca imaginei que ia dar de cara com a minha cachorrinha na mesa da necropsia.  Na boa, nem me pediram","0","1","7","0","Wed Dec 06 23:42:55 +0000 2023","0","false","false"
"https://x.com/dab7iu/status/1732544997293998495","https://twitter.com/dab7iu/status/1732544997293998495","1732544997293998495","to cumprindo a promessa que eu fiz pra mim mesmo que eu ia dominar essa porra","1","0","3","0","Wed Dec 06 23:38:11 +0000 2023","0","false","false"
"https://x.com/kadhijaa_/status/1732544570653565280","https://twitter.com/kadhijaa_/status/1732544570653565280","1732544570653565280","a santana ia traumatizar o roman mais do que o logan","1","0","2","0","Wed Dec 06 23:36:29 +0000 2023","0","false","true"
"https://x.com/garciameel_/status/1732545590632784254","https://twitter.com/garciameel_/status/1732545590632784254","1732545590632784254","Só sei choraaaaarrrrr, as pessoas comprando a rifa meu Deus, obrigadaaaaaaa, eu cheia de medo achando q ngm ia comprar 😭😭😭😭😭😭😭🙌🏻🙌🏻🙌🏻🙌🏻","0","1","4","0","Wed Dec 06 23:40:32 +0000 2023","0","false","false"
"https://x.com/revistaforum/status/1732547937270440038","https://twitter.com/revistaforum/status/1732547937270440038","1732547937270440038","Gemini: Nova ferramenta de IA do Google chega para competir com ChatGPT

Leia mais: https://t.co/AUlmkjzoHQ https://t.co/r22IoYgnZ6","0","1","8","0","Wed Dec 06 23:49:52 +0000 2023","0","false","false"
"https://x.com/luiizot_/status/1732544439594123395","https://twitter.com/luiizot_/status/1732544439594123395","1732544439594123395","Carai q ano loco ne vei
Me formei, arrumei um trampo foda, voltei com atividade fisica
O Luiz de 2022 n ia acreditar nem vendo","0","2","10","0","Wed Dec 06 23:35:58 +0000 2023","0","false","false"
"https://x.com/huugodavilla/status/1732544374372806703","https://twitter.com/huugodavilla/status/1732544374372806703","1732544374372806703","Se eu fosse assim eu ia tão nojento","0","1","9","0","Wed Dec 06 23:35:42 +0000 2023","0","false","true"
