"url","twitterUrl","id","text","retweetCount","replyCount","likeCount","quoteCount","createdAt","bookmarkCount","isRetweet","isQuote"
"https://x.com/Godofredo243318/status/1732478570574774392","https://twitter.com/Godofredo243318/status/1732478570574774392","1732478570574774392","Google lança IA Gemini capaz de ensinar matemática e programar https://t.co/6wRDRVRe1U","0","0","0","0","Wed Dec 06 19:14:13 +0000 2023","0","false","false"
"https://x.com/nandagomesai/status/1732546579410681935","https://twitter.com/nandagomesai/status/1732546579410681935","1732546579410681935","Desvendando a Nova Era da Inteligência Artificial - Gemini vs. GPT-4 https://t.co/Ut4PNDC9Xc","0","0","1","0","Wed Dec 06 23:44:28 +0000 2023","0","false","false"
"https://x.com/DiogoAFSimoes/status/1732478907650052285","https://twitter.com/DiogoAFSimoes/status/1732478907650052285","1732478907650052285","Gemini: novo modelo de IA da Google resolve e corrige equações passo-a-passo https://t.co/fe6OcbtTnh","0","0","0","0","Wed Dec 06 19:15:34 +0000 2023","0","false","false"
"https://x.com/ricardoover/status/1732232003590778923","https://twitter.com/ricardoover/status/1732232003590778923","1732232003590778923","#ChatGPT 

Tentando fazer o ChatGPT fazer engenharia reversa de um cálculo customizado de CRC. Essa foi a terceira tentativa da noite (tive que simplificar dramaticamente os números).

https://t.co/hIhMEybd4k","0","0","0","0","Wed Dec 06 02:54:27 +0000 2023","0","false","false"
"https://x.com/site_novidades/status/1732419861970599982","https://twitter.com/site_novidades/status/1732419861970599982","1732419861970599982","E aí, devs! 👨‍💻🚀 A Microsoft tá turbinando o Copilot com a nova GPT-4 Turbo! Mais contexto, Code Interpreter pra execução de código e até o DALL-E 3 pra imagens top! Se liga nessa revolução 🤖 e confere as novas features aqui: https://t.co/3jK1UQ7TNO","0","0","1","0","Wed Dec 06 15:20:56 +0000 2023","0","false","false"
"https://x.com/siqueira_rafa10/status/1732531239108694327","https://twitter.com/siqueira_rafa10/status/1732531239108694327","1732531239108694327","@_victoralvares https://t.co/UhqtOniC4r
Cria uma conta e joga suas perguntas pra ele kkk","0","0","0","0","Wed Dec 06 22:43:30 +0000 2023","0","false","false"
"https://x.com/canaltech/status/1732502057850974705","https://twitter.com/canaltech/status/1732502057850974705","1732502057850974705","Google anunciou nesta quarta (6) o Gemini, seu novo modelo fundacional; novidade estreia no Bard, vai funcionar no Android e chega em breve à Busca https://t.co/rEWn2lqzv4","4","0","34","0","Wed Dec 06 20:47:33 +0000 2023","2","false","false"
"https://x.com/BloombergLineaB/status/1732190324741558326","https://twitter.com/BloombergLineaB/status/1732190324741558326","1732190324741558326","#OPINIÃO | Quando os sistemas de IA começam a resolver problemas, a tentação é dar a eles mais responsabilidade. Mas isso também exige cautela.

Leia mais:

https://t.co/9Btf8H4y1e
https://t.co/9Btf8H4y1e","0","0","1","0","Wed Dec 06 00:08:50 +0000 2023","0","false","false"
"https://x.com/htttpcherry/status/1732476912209969482","https://twitter.com/htttpcherry/status/1732476912209969482","1732476912209969482","mandei o chat gpt fazer progressão de jazz pra mim e ficou uma bosta robo burro do krl","0","1","7","0","Wed Dec 06 19:07:38 +0000 2023","0","false","false"
"https://x.com/papipapito_/status/1732420989886271857","https://twitter.com/papipapito_/status/1732420989886271857","1732420989886271857","essa primeira é o cúmulo do gato, chatgpt could never","0","0","4","0","Wed Dec 06 15:25:25 +0000 2023","0","false","true"
"https://x.com/anjinhachan/status/1732441694040178953","https://twitter.com/anjinhachan/status/1732441694040178953","1732441694040178953","incrível como o Chat GPT ficou completamente estúpido com o passar do tempo

os caras achavam que AI ia aprender com as pessoas fazendo pergunta e acabou emburrecendo horrores","0","2","12","0","Wed Dec 06 16:47:41 +0000 2023","0","false","false"
"https://x.com/felipekanc/status/1732344119010431138","https://twitter.com/felipekanc/status/1732344119010431138","1732344119010431138","pede pro chatgpt te explicar semiotica acho q vai dar um help","0","0","2","0","Wed Dec 06 10:19:58 +0000 2023","0","false","true"
"https://x.com/oginoino/status/1732406335860351345","https://twitter.com/oginoino/status/1732406335860351345","1732406335860351345","@ocodista Obrigado. Ficou ótimo. Parece até que voce pediu para o Chat GPT explicar para uma criança de 12 anos. Entendi dessa vez. Valeu pela disposição.","0","1","7","0","Wed Dec 06 14:27:11 +0000 2023","0","false","false"
"https://x.com/anjinhachan/status/1732441889280835890","https://twitter.com/anjinhachan/status/1732441889280835890","1732441889280835890","a única utilidade atual do ChatGPT é pedir pra escrever uma frase em 10 variações diferentes pra não ficar repetitiva","0","1","4","0","Wed Dec 06 16:48:28 +0000 2023","0","false","false"
"https://x.com/ThiagoKrause2/status/1732528852822331569","https://twitter.com/ThiagoKrause2/status/1732528852822331569","1732528852822331569","@rphlbruce Parece uma resposta gerada pelo ChatGPT com prompt de millennial desse meme. https://t.co/DoN081ZzP2","0","0","2","0","Wed Dec 06 22:34:01 +0000 2023","0","false","false"
"https://x.com/torutsz/status/1732192489853841839","https://twitter.com/torutsz/status/1732192489853841839","1732192489853841839","@LZ8865 Mas tanto a ia de imagem quanto a de texto roubam EMPREGOS, já tem caso de gnt q usa um chat gpt da vida pra fazer livros infantis q são vendidos na Amazon, de novo, ia não é e nunca vai ser aliada da classe trabalhadora no capitalismo","0","1","1","0","Wed Dec 06 00:17:26 +0000 2023","0","false","false"
"https://x.com/CarlosEduardoCD/status/1732406743496589820","https://twitter.com/CarlosEduardoCD/status/1732406743496589820","1732406743496589820","Se o ChatGPT não conhece o seu banco de dados, é óbvio que o mesmo irá inventar tabelas e colunas que não existem no seu modelo.

E mesmo se conhecesse, não existem garantias de que irá entregar exatamente o que foi solicitado.","0","1","4","0","Wed Dec 06 14:28:48 +0000 2023","0","false","false"
"https://x.com/NewsAndLeaksBR/status/1732197697069752763","https://twitter.com/NewsAndLeaksBR/status/1732197697069752763","1732197697069752763","@MattTheBast Seria muito foda se a Epic começasse a nova história com esse tópico. Mas infelizmente pelo andar da carruagem acho que a Epic tá cada vez mais no modo ""chat gpt"" pra história. 

ainda to com um pingo de esperança para aqueles quadrinhos que vazaram: ordem restaurada","0","1","12","0","Wed Dec 06 00:38:08 +0000 2023","0","false","false"
"https://x.com/WilliamDS17/status/1732213398631223684","https://twitter.com/WilliamDS17/status/1732213398631223684","1732213398631223684","eu tenho 100 tokens de energia no Bing, oq eu faço? vou fazer pesquisas acadêmicas otimas? não 

“Jesus mostrando que é mais foda que satanas","0","0","0","0","Wed Dec 06 01:40:31 +0000 2023","0","false","false"
"https://x.com/tanyayikess/status/1732492230533804091","https://twitter.com/tanyayikess/status/1732492230533804091","1732492230533804091","@igormellooooo Amg, vc tá usando o bing? O meu aparece ""Aviso de conteúdo"" quando tento criar","0","1","1","0","Wed Dec 06 20:08:30 +0000 2023","0","false","false"
"https://x.com/Mateus_Aquinoo/status/1732521542263640438","https://twitter.com/Mateus_Aquinoo/status/1732521542263640438","1732521542263640438","@matheust2901 GPT4 faz, mas nunca tentei, tem o bing tbm que é de graça fora alguns do discord, mas uso o gpt4 todo dia no trabalho","0","1","0","0","Wed Dec 06 22:04:59 +0000 2023","0","false","false"
"https://x.com/mirageheels/status/1732538794870456367","https://twitter.com/mirageheels/status/1732538794870456367","1732538794870456367","queria ter brincado no bing ai qnd ele ainda deixava colocar famoso, queria muito ter participado disso","0","0","0","0","Wed Dec 06 23:13:32 +0000 2023","0","false","false"
"https://x.com/robozindomau/status/1732431447808500219","https://twitter.com/robozindomau/status/1732431447808500219","1732431447808500219","@coffeeandcode @kailanefelx Na dúvida usa a IA do bing (o da Microsoft), tem versão mobile e também usa o chatGPT 4 que é a versão mais atualizada o chatGPT","0","1","1","0","Wed Dec 06 16:06:58 +0000 2023","0","false","false"
"https://x.com/murti_bing/status/1732535402437779478","https://twitter.com/murti_bing/status/1732535402437779478","1732535402437779478","@jgoodmansunset @JusPlainTalk101 Senate Republicans.","0","0","2","0","Wed Dec 06 23:00:03 +0000 2023","0","false","false"
"https://x.com/Sinaisdeum_anjo/status/1732204321284985256","https://twitter.com/Sinaisdeum_anjo/status/1732204321284985256","1732204321284985256","sim, eu estou chorando de saudade do chandler bing","0","0","0","0","Wed Dec 06 01:04:27 +0000 2023","0","false","false"
"https://x.com/isabellaaos/status/1732337477724295637","https://twitter.com/isabellaaos/status/1732337477724295637","1732337477724295637","@LuanaBa12686441 @carolztuita @antonellavanoni Vai que o Joca é o melhor e único amigo do Bing, já estou criando as histórias na minha cabeça","0","0","7","0","Wed Dec 06 09:53:34 +0000 2023","0","false","false"
"https://x.com/nimesulinda/status/1732190892310602049","https://twitter.com/nimesulinda/status/1732190892310602049","1732190892310602049","@carolztuita @antonellavanoni Do Mitchell talvez, mas o Bing não é muito de socializar","0","0","65","0","Wed Dec 06 00:11:05 +0000 2023","0","false","false"
"https://x.com/Igor_gilton/status/1732385494850318610","https://twitter.com/Igor_gilton/status/1732385494850318610","1732385494850318610","@Jrabbit55555 Como assim Google se estás a usar Bing
😶","0","0","3","0","Wed Dec 06 13:04:22 +0000 2023","0","false","false"
"https://x.com/jaohrk/status/1732533225937920436","https://twitter.com/jaohrk/status/1732533225937920436","1732533225937920436","@asflavin Um amg fez pelo Bing","0","0","1","0","Wed Dec 06 22:51:24 +0000 2023","0","false","false"
"https://x.com/Sinaisdeum_anjo/status/1732210523763081469","https://twitter.com/Sinaisdeum_anjo/status/1732210523763081469","1732210523763081469","eu tô chorando igual uma cachorra, Matthew Perry eu ainda não consigo acreditar que vc se foi, te amo p sempre meu chandler bing","0","0","0","0","Wed Dec 06 01:29:06 +0000 2023","0","false","false"
"https://x.com/abedsmind/status/1732193305213927808","https://twitter.com/abedsmind/status/1732193305213927808","1732193305213927808","@cacauzinhoxou Que absurdo derem nota baixa pra um doguinho, principalmente um chamado de bing","0","0","0","0","Wed Dec 06 00:20:41 +0000 2023","0","false","false"
"https://x.com/Wannady_/status/1732540335190855738","https://twitter.com/Wannady_/status/1732540335190855738","1732540335190855738","@DehFariaseLima Eu tô usando o criador de imagens do Bing amg","0","1","1","0","Wed Dec 06 23:19:39 +0000 2023","0","false","false"
"https://x.com/baarthur0/status/1732224386491449772","https://twitter.com/baarthur0/status/1732224386491449772","1732224386491449772","@puentes_arteta @baruqrodrigues valeu, José! tô usando a do ArcGIS e caiu bem, e pelo q eu vi não tem limite. agr já tô em casa mas amanhã cedo vou ver a do bing!","0","0","1","0","Wed Dec 06 02:24:11 +0000 2023","0","false","false"
"https://x.com/filipesalles23/status/1732402646412140864","https://twitter.com/filipesalles23/status/1732402646412140864","1732402646412140864","@rewardsbrasil A sensação que eu tenho é que tem de esperar alguns segundos, não pode sair emendando uma na outra, que nem se faz na lista de jogos do app do Bing no Xbox, que dá pra passar super rápido","0","0","0","0","Wed Dec 06 14:12:32 +0000 2023","0","false","false"
"https://x.com/lukebluebeam/status/1732217566938964023","https://twitter.com/lukebluebeam/status/1732217566938964023","1732217566938964023","@rewardsbrasil @garywal Adm, minha conta começou a não precisar mais do intervalo de 15 minutos pra fazer pesquisas pelo bing agora a noite.","0","2","5","0","Wed Dec 06 01:57:05 +0000 2023","0","false","false"
"https://x.com/Fabricio_Sasaki/status/1732491202887294978","https://twitter.com/Fabricio_Sasaki/status/1732491202887294978","1732491202887294978","@giovannibassi Eu já consegui ser banido por 1 dia pelo chatgpt e 1 dia no Bing AI, só forçando a responder como singularidade de buraco negro tem volume zero e densidade infinita sendo que a fórmula da densidade é dividir pelo volume e divisão por zero não pode dar infinito. Bugava tudo.","0","0","2","0","Wed Dec 06 20:04:25 +0000 2023","0","false","false"
"https://x.com/gugaoshow/status/1732195716829761754","https://twitter.com/gugaoshow/status/1732195716829761754","1732195716829761754","Eu acumulava muitos pontos no Microsoft Rewards (@msdevbr) usando o edge e o Bing, mas agora eles DESTRUÍRAM o programa e estou triste.","0","0","1","0","Wed Dec 06 00:30:16 +0000 2023","0","false","false"
"https://x.com/GamesKenshin/status/1732369074665984360","https://twitter.com/GamesKenshin/status/1732369074665984360","1732369074665984360","@rewardsbrasil Muita gente já estava deixando de usar por causa deste intervalo o edge e o bing
acho que sentiram no bolso e tiveram q   voltar atrás com essa  decisão idiota de intervalo de 15 minutos","0","0","0","0","Wed Dec 06 11:59:07 +0000 2023","0","false","false"
"https://x.com/catingas/status/1732550174583459946","https://twitter.com/catingas/status/1732550174583459946","1732550174583459946","meu pai foi assaltado ontem levaram todo o dinheiro do salário dele apontaram arma deram um cacete e o patrão dele tava preocupado se ele ia conseguir cobrir um outro cara do trabalho dele hj https://t.co/7dYLAmJ8TS","0","0","0","0","Wed Dec 06 23:58:45 +0000 2023","0","false","false"
"https://x.com/junozolanski/status/1732549535501636068","https://twitter.com/junozolanski/status/1732549535501636068","1732549535501636068","A patroa da minha mãe querendo passar a perna nela e achando que ngm ia perceber

https://t.co/YWwyZCNdt7","0","0","0","0","Wed Dec 06 23:56:13 +0000 2023","0","false","false"
"https://x.com/hyeaeri_/status/1732550102965768509","https://twitter.com/hyeaeri_/status/1732550102965768509","1732550102965768509","Mds, agora q lembrei q gastei o dinheiro q eu ia pagar meu Spotify, MAS Q CRL EU NÃO POSSO PULAR A MÚSICAAAAAA https://t.co/aMI1SAFXix","0","0","0","0","Wed Dec 06 23:58:28 +0000 2023","0","false","false"
"https://x.com/BatataDescolada/status/1732549583874486334","https://twitter.com/BatataDescolada/status/1732549583874486334","1732549583874486334","Eu fiquei mt arrepiado e eu já sabia oq ia acontecer https://t.co/UHYRrp2VSl","0","0","0","0","Wed Dec 06 23:56:24 +0000 2023","0","false","true"
"https://x.com/piiastra/status/1732549406904229921","https://twitter.com/piiastra/status/1732549406904229921","1732549406904229921","coloquei minha equipe pq nunca q eu ia com aql povinho da redbull https://t.co/gTPzxQcXJE","0","2","5","0","Wed Dec 06 23:55:42 +0000 2023","0","false","true"
"https://x.com/priprioca_/status/1732549789391221174","https://twitter.com/priprioca_/status/1732549789391221174","1732549789391221174","Eu ia jantar mas eu tô sendo jantado por essa baixaria teológica maldita. Pra esclarecer: quando ele diz não fique com esposa de outro, não é sobre traição. É sobre ficar com alguém com o qual vc não sabe se será seu para sempre, então você pode tá roubando a noiva de outra pesso https://t.co/1ed8TRnSws","0","0","0","0","Wed Dec 06 23:57:13 +0000 2023","0","false","false"
"https://x.com/mucitoveyr/status/1732550203478085894","https://twitter.com/mucitoveyr/status/1732550203478085894","1732550203478085894","EU AVISEI. EU AVISEI QUE ELA IA VIR. https://t.co/bUSbEdJSDq","0","0","1","0","Wed Dec 06 23:58:52 +0000 2023","0","false","false"
"https://x.com/avulp3s/status/1732549378357768207","https://twitter.com/avulp3s/status/1732549378357768207","1732549378357768207","nossa eu q repeti 1 ano ia pra escola td dia faltando isso aqui 🤏 pra eu surtar... imagina refazer o ensino médio TODO por vários anos https://t.co/rSH027a7Lj","0","0","1","0","Wed Dec 06 23:55:35 +0000 2023","0","false","true"
"https://x.com/cannibalcoeur/status/1732549489561407685","https://twitter.com/cannibalcoeur/status/1732549489561407685","1732549489561407685","a gente juntas ia ser algo bem nessa vibe https://t.co/bvjCRoz5Hh","0","1","0","0","Wed Dec 06 23:56:02 +0000 2023","0","false","false"
"https://x.com/_claraa07/status/1732549665650770044","https://twitter.com/_claraa07/status/1732549665650770044","1732549665650770044","Dias e dias e eu sabia que essa dia ia chegar..","0","0","0","0","Wed Dec 06 23:56:44 +0000 2023","0","false","false"
"https://x.com/medicinemadden/status/1732550082489176216","https://twitter.com/medicinemadden/status/1732550082489176216","1732550082489176216","Pensando muito em se o Richard tivesse em Gladiador 2, eu ia ter ele com o Pedro Pascal https://t.co/O8EVtZV9NA","0","0","0","0","Wed Dec 06 23:58:23 +0000 2023","0","false","false"
"https://x.com/mszntos/status/1732550001606160491","https://twitter.com/mszntos/status/1732550001606160491","1732550001606160491","tava aqui lembrando de quando ia pra academia com minha irma anna... af a gnt era doida igual 2022 foi bom","0","1","0","0","Wed Dec 06 23:58:04 +0000 2023","0","false","false"
"https://x.com/_mariekins_/status/1732550376178507977","https://twitter.com/_mariekins_/status/1732550376178507977","1732550376178507977","ia fazer unha, comprar algumas coisinha e simplesmente desisti de tudo","0","0","0","0","Wed Dec 06 23:59:33 +0000 2023","0","false","false"
"https://x.com/mariitotosa/status/1732549234392465768","https://twitter.com/mariitotosa/status/1732549234392465768","1732549234392465768","ia pra escola e me obrigaram a beber🤡","0","1","0","0","Wed Dec 06 23:55:01 +0000 2023","0","false","false"
"https://x.com/_bellcristina/status/1732550469103296773","https://twitter.com/_bellcristina/status/1732550469103296773","1732550469103296773","Nunca na minha vida eu imaginei que com 26 anos eu ia estar CHORANDO IGUAL CRIANÇA POR CAUSA DA PORRA DE UM INGRESSO DE UMA BANDA 😭😭😭😭😭","0","0","1","0","Wed Dec 06 23:59:55 +0000 2023","0","false","false"
"https://x.com/lzguilherm/status/1732550404116803814","https://twitter.com/lzguilherm/status/1732550404116803814","1732550404116803814","Terminei com a minha primeira namorada pq ela ia pra SP e eu ficar, agr vou terminar com meu namorado pq vou para SP e ele ficar. Ambos com data marcada para acabar. Universo.","0","0","2","0","Wed Dec 06 23:59:40 +0000 2023","0","false","false"
"https://x.com/SirSuiciniv/status/1732549885944082500","https://twitter.com/SirSuiciniv/status/1732549885944082500","1732549885944082500","os navios portugueses 💀💀💀 ia filha da puta","0","0","1","0","Wed Dec 06 23:57:36 +0000 2023","0","false","true"
"https://x.com/_garciamax/status/1732549674051993939","https://twitter.com/_garciamax/status/1732549674051993939","1732549674051993939","Eu ia perguntar como ela arrumou dinheiro pra pagar","0","0","2","0","Wed Dec 06 23:56:46 +0000 2023","0","false","true"
"https://x.com/oplugth30/status/1732549714451571101","https://twitter.com/oplugth30/status/1732549714451571101","1732549714451571101","ia mandar msg mas fds tbm","0","0","0","0","Wed Dec 06 23:56:55 +0000 2023","0","false","false"
"https://x.com/imnothenrike/status/1732549775562551386","https://twitter.com/imnothenrike/status/1732549775562551386","1732549775562551386","parecia que tudo ia dar errado, mas arrasamos tanto","0","0","1","0","Wed Dec 06 23:57:10 +0000 2023","0","false","false"
"https://x.com/Heir_of_crux/status/1732199380101239089","https://twitter.com/Heir_of_crux/status/1732199380101239089","1732199380101239089","@maybe_gemini FOFOCA
ADORO","0","1","1","0","Wed Dec 06 00:44:49 +0000 2023","0","false","false"
"https://x.com/WeLoveHer07/status/1732390675767783658","https://twitter.com/WeLoveHer07/status/1732390675767783658","1732390675767783658","Leo 🌞 
Gemini 🌙 
Libra ⬆️","0","0","2","0","Wed Dec 06 13:24:58 +0000 2023","0","false","true"
"https://x.com/exame/status/1732448327348703527","https://twitter.com/exame/status/1732448327348703527","1732448327348703527","Gemini AI: tudo que você precisa saber sobre a nova inteligência artificial do Google

https://t.co/5y1qRwSfZI","0","0","3","0","Wed Dec 06 17:14:03 +0000 2023","1","false","false"
"https://x.com/JornalOGlobo/status/1732525628560388099","https://twitter.com/JornalOGlobo/status/1732525628560388099","1732525628560388099","Google lança Gemini, inteligência artificial para rivalizar com o ChatGPT; saiba tudo https://t.co/XzRHhgbV7G . Clique na foto","2","1","6","0","Wed Dec 06 22:21:13 +0000 2023","1","false","false"
"https://x.com/uwuboo___/status/1732492718482264297","https://twitter.com/uwuboo___/status/1732492718482264297","1732492718482264297","Geminis","1","0","2","0","Wed Dec 06 20:10:26 +0000 2023","0","false","true"
"https://x.com/VEJA/status/1732447056445210672","https://twitter.com/VEJA/status/1732447056445210672","1732447056445210672","Google lança Gemini, nova ferramenta de inteligência artificial  https://t.co/NExKA9EQle","0","1","6","0","Wed Dec 06 17:09:00 +0000 2023","0","false","false"
"https://x.com/Guayahuasca/status/1732240840674750510","https://twitter.com/Guayahuasca/status/1732240840674750510","1732240840674750510","@Guarromantico_ libra geminis matrimonio","0","0","3","0","Wed Dec 06 03:29:34 +0000 2023","0","false","false"
"https://x.com/Tecnoblog/status/1732212843896857051","https://twitter.com/Tecnoblog/status/1732212843896857051","1732212843896857051","Google adia novo modelo de IA Gemini para 2024 #valeapenaler https://t.co/qrSjCW9eE5","1","0","7","0","Wed Dec 06 01:38:19 +0000 2023","0","false","false"
"https://x.com/dntwit/status/1732549762770174057","https://twitter.com/dntwit/status/1732549762770174057","1732549762770174057","A Google lança o Gemini, a sua IA ""maior e mais capaz"" (com vídeo) https://t.co/rHZxSA149C","0","0","2","0","Wed Dec 06 23:57:07 +0000 2023","0","false","false"
"https://x.com/Tecnoblog/status/1732448703888175155","https://twitter.com/Tecnoblog/status/1732448703888175155","1732448703888175155","Google revela Gemini, novo modelo de IA que vai equipar Bard e smartphones – ACESSE agora 👇 https://t.co/K5kUHL0ESC","1","0","8","0","Wed Dec 06 17:15:33 +0000 2023","0","false","false"
"https://x.com/fplopez50/status/1732538008270733442","https://twitter.com/fplopez50/status/1732538008270733442","1732538008270733442","Vocês acham que o ChatGPT vai acabar com muitos empregos, espera pra ver o estrago que o tal Gemini vai fazer.
Google lançou hoje.
O troço é assustador.","0","1","1","0","Wed Dec 06 23:10:24 +0000 2023","0","false","false"
"https://x.com/Misinufa/status/1732315866904076635","https://twitter.com/Misinufa/status/1732315866904076635","1732315866904076635","@azevenus Este vídeo é maravilhoso. A começar na cara de safado de 4 e a acabar no sorriso de Gun. Até admira Gemini não andar a pairar por ali.","0","0","1","0","Wed Dec 06 08:27:42 +0000 2023","0","false","false"
"https://x.com/1cadumagalhaes/status/1732462354321825837","https://twitter.com/1cadumagalhaes/status/1732462354321825837","1732462354321825837","@giovannibassi Curioso pra ver isso na prática. Os modelos de linguagem tipo o GPT erram bastante na resolução de problemas matemáticos, será que esse Gemini tem treinamentos específicos?","0","0","2","0","Wed Dec 06 18:09:47 +0000 2023","0","false","false"
"https://x.com/lucasradaelli/status/1732452436709666879","https://twitter.com/lucasradaelli/status/1732452436709666879","1732452436709666879","O novo modelo de AI do Google, Gemini, é algo absurdamente incrível!!! Os usos pra acessibilidade são vários!  https://t.co/FgkJt3RJpx","0","1","15","0","Wed Dec 06 17:30:22 +0000 2023","2","false","false"
"https://x.com/anemaria1129/status/1732511325316694447","https://twitter.com/anemaria1129/status/1732511325316694447","1732511325316694447","@lih_hilih Não queria te desiludir, mas tu não consegue competir nem com o First em quem ama mais o Khao, imagina com o Gemini em relação ao Fourth kkkkkkkkk.... Mas não custa se iludir","0","2","1","0","Wed Dec 06 21:24:23 +0000 2023","0","false","false"
"https://x.com/Heir_of_crux/status/1732198789471957355","https://twitter.com/Heir_of_crux/status/1732198789471957355","1732198789471957355","@maybe_gemini O pior vai ser ter que provar agora por videos de step by step que não é IA.
E o meu medo é que até esses videos podem ser usados como material pra IA melhorar","0","1","1","0","Wed Dec 06 00:42:28 +0000 2023","0","false","false"
"https://x.com/curtonews/status/1732518824665137633","https://twitter.com/curtonews/status/1732518824665137633","1732518824665137633","Gemini, novo modelo de IA do Google, supera ChatGPT em testes

https://t.co/E1qt1M0qXG","0","0","1","0","Wed Dec 06 21:54:11 +0000 2023","0","false","false"
"https://x.com/Estadao/status/1732449824791031899","https://twitter.com/Estadao/status/1732449824791031899","1732449824791031899","RIVAL DO CHATGPT

Google lança Gemini, 'super IA' que vai estar disponível para o Bard; saiba como vai funcionar em @EstadaoLink 

https://t.co/bx5hVaonUz","1","2","5","1","Wed Dec 06 17:20:00 +0000 2023","1","false","false"
"https://x.com/bancaynegocios/status/1732453360362545286","https://twitter.com/bancaynegocios/status/1732453360362545286","1732453360362545286","Google presenta el modelo de IA Gemini, que espera derrotar a ChatGPT de OpenAI https://t.co/k0zWwPoDCQ","1","0","2","0","Wed Dec 06 17:34:03 +0000 2023","0","false","false"
"https://x.com/luisoliveros13/status/1732479131047076320","https://twitter.com/luisoliveros13/status/1732479131047076320","1732479131047076320","Google anuncia Gemini, promete.","1","1","6","0","Wed Dec 06 19:16:27 +0000 2023","0","false","false"
