"url","twitterUrl","id","text","retweetCount","replyCount","likeCount","quoteCount","createdAt","bookmarkCount","isRetweet","isQuote"
"https://x.com/T2iD_/status/1732455403148243269","https://twitter.com/T2iD_/status/1732455403148243269","1732455403148243269","O CEO da OpenAI, Sam Altman, comemora o primeiro aniversário do ChatGPT – ""Há um ano, provavelmente estávamos sentados no escritório dando os retoques finais no ChatGPT antes do lançamento na manhã seguinte"" https://t.co/br9ohfXy4Y #Notícias #Altman #aniversário #ano #antes","0","0","1","0","Wed Dec 06 17:42:10 +0000 2023","0","false","false"
"https://x.com/AluraOnline/status/1732407524090089512","https://twitter.com/AluraOnline/status/1732407524090089512","1732407524090089512","🤖 IA que cria imagens 🤖 

Outra sensação são as IAs que criam imagens a partir de texto. Podemos citar a ferramenta DALL E, criada pela @OpenAI.

Pesquisamos a palavra “Fundo do Mar Cyberpunk” e confere só o que saiu!  

Explore a ferramenta em: https://t.co/Q13LdoLQUD https://t.co/yBkDOm3W1f","0","1","2","0","Wed Dec 06 14:31:54 +0000 2023","0","false","false"
"https://x.com/antoniohermanos/status/1732449959306215649","https://twitter.com/antoniohermanos/status/1732449959306215649","1732449959306215649","Que outros sites além do https://t.co/p2dzCmz11B permitem você usar sua chave API da OpenAI para testar o produto?","0","0","0","0","Wed Dec 06 17:20:32 +0000 2023","0","false","false"
"https://x.com/jfborges/status/1732467487646646733","https://twitter.com/jfborges/status/1732467487646646733","1732467487646646733","Como os professores estão a usar o ChatGPT | OpenAi https://t.co/4Ey3tmSyvb via @jfborges","0","0","0","0","Wed Dec 06 18:30:11 +0000 2023","0","false","false"
"https://x.com/Snyviper/status/1732371041148666217","https://twitter.com/Snyviper/status/1732371041148666217","1732371041148666217","A OpenAI (empresa por trás do ChatGPT) está criando uma ""Inteligência Artificial Geral"" chamada de Q*, e embora ela ainda esteja em sua fase primitiva, essa matéria explica muito bem o quão significante ela vai se tornar quanto ficar pronta.

https://t.co/oJyPm7tBtG","0","0","0","0","Wed Dec 06 12:06:56 +0000 2023","0","false","false"
"https://x.com/tebetdiaba/status/1732439537933042085","https://twitter.com/tebetdiaba/status/1732439537933042085","1732439537933042085","inteligência artificial foi longe demais trouxeram a lu do magalu pro mundo real 😯
https://t.co/UUW2kDSbSb","6","0","70","0","Wed Dec 06 16:39:07 +0000 2023","4","false","false"
"https://x.com/FrancisAHamer/status/1732393901380469184","https://twitter.com/FrancisAHamer/status/1732393901380469184","1732393901380469184","Depois dizem que as músicas de hj são músicas, trocentos recursos digitais e inteligência artificial para gemer no no microfone e dizer que bater a ""Raba no Chão"".... https://t.co/dXH8GY6VDD","25","16","70","2","Wed Dec 06 13:37:47 +0000 2023","2","false","false"
"https://x.com/Grzsbt/status/1732408163222118600","https://twitter.com/Grzsbt/status/1732408163222118600","1732408163222118600","oioi, venho através desse post para alertar vcs, essa conta no app vizinho posta várias coisas de crochê só que é de IA (inteligência artificial) e quem trabalha com crochê e com artesanal sabe o tanto que isso é chato e desrespeitoso+ https://t.co/TnRDj0jm2t","55","8","221","8","Wed Dec 06 14:34:27 +0000 2023","8","false","false"
"https://x.com/IA_Corvo/status/1732484905748013530","https://twitter.com/IA_Corvo/status/1732484905748013530","1732484905748013530","Inteligência Artificial chegou à pesquisa do Google ! 🛑

Se ainda não está usando, está perdendo ! 🚀

Confira 5 recursos de IA surpreendentes :

-- THREAD 🧵🐦‍⬛ https://t.co/ApmxC65LkW","2","4","13","1","Wed Dec 06 19:39:24 +0000 2023","15","false","false"
"https://x.com/EduVieira1986/status/1732414795477884947","https://twitter.com/EduVieira1986/status/1732414795477884947","1732414795477884947","O ministro do Supremo Tribunal Federal e presidente do TSE, Alexandre de Moraes, disse em seminário feito pela Fundação Getúlio Vargas, que acha necessário que políticos e candidatos que utilizarem inteligência artificial para criar fake News, durante as eleições municipais de 2024, devem ser cassados.","6","2","12","0","Wed Dec 06 15:00:48 +0000 2023","0","false","false"
"https://x.com/SergioHontza/status/1732197206516478433","https://twitter.com/SergioHontza/status/1732197206516478433","1732197206516478433","Eu usando a inteligência artificial de forma maléfica para conseguir dominar o mundo. 🖕🏻🥚🤣🤣🤣 https://t.co/gHUgFKc5da","0","0","4","0","Wed Dec 06 00:36:11 +0000 2023","0","false","true"
"https://x.com/Ittsizzys/status/1732542633686209003","https://twitter.com/Ittsizzys/status/1732542633686209003","1732542633686209003","Maldita inteligência artificial saia do supermercado que eu faço compras imediatamente! 

(Eu acho que é ia) https://t.co/RU1v7eu9nQ","1","6","10","0","Wed Dec 06 23:28:47 +0000 2023","0","false","false"
"https://x.com/lirouleo_/status/1732232564973113537","https://twitter.com/lirouleo_/status/1732232564973113537","1732232564973113537","esse vídeo meio que gerou as paródias feitas com inteligência artificial ne?
https://t.co/9xQLVhKNSv","1","3","53","0","Wed Dec 06 02:56:41 +0000 2023","1","false","false"
"https://x.com/paulada_xd/status/1732265349289009610","https://twitter.com/paulada_xd/status/1732265349289009610","1732265349289009610","caralho inteligencia artificial eh muito pica vei https://t.co/XA07mZMbKZ","0","6","30","0","Wed Dec 06 05:06:57 +0000 2023","0","false","false"
"https://x.com/pedrohmfariaa/status/1732427352108343786","https://twitter.com/pedrohmfariaa/status/1732427352108343786","1732427352108343786","naquele boom de imagens de inteligência artificial, eu fiz vários testes de fotos da Taylor pra montar um conceito pro TS11, e uma da fotos ficou super parecida com a do ensaio de hoje https://t.co/FRL5Eg8kIq","0","1","5","0","Wed Dec 06 15:50:42 +0000 2023","0","false","false"
"https://x.com/TarcisoRenova/status/1732365857739739271","https://twitter.com/TarcisoRenova/status/1732365857739739271","1732365857739739271","⚠️ Esse vídeo não foi gravado na Faixa de Gaza

Usei inteligência artificial para analisar o vídeo abaixo e posso confirmar que o conteúdo não foi gravado na Faixa de Gaza durante a inundação dos túneis por Israel.

O idioma falado no vídeo é o russo. 🇷🇺

O homem grita algo como ""Продолжение следует..."", o que podemos traduzir como ""Corre"" ou ""Continua"".

Outro ponto crucial para atestar a falsidade do vídeo é que a fonte que divulgou o conteúdo não tinha histórico de cobertura da guerra Israel-Hamas, mas sim da guerra Ucrânia-Rússia.","37","18","297","2","Wed Dec 06 11:46:20 +0000 2023","3","false","false"
"https://x.com/CentralKJenner/status/1732344653909811607","https://twitter.com/CentralKJenner/status/1732344653909811607","1732344653909811607","Kendall Jenner como 'Billie' para o projeto Javas do Meta de inteligência Artificial. https://t.co/ehQXCO4crq","2","0","11","0","Wed Dec 06 10:22:05 +0000 2023","0","false","false"
"https://x.com/jossano_morais/status/1732472915625497068","https://twitter.com/jossano_morais/status/1732472915625497068","1732472915625497068","Notícia publicada pela @CNNBrasil, com uma série de problemas, mas a mais evidente é a horrível imagem feita por inteligência artificial, qualquer um consegue ver que isso aí tá muito errado, mas tem mais problemas   + https://t.co/ex9Z2Hq2CH","24","6","224","3","Wed Dec 06 18:51:45 +0000 2023","13","false","false"
"https://x.com/ebcnarede/status/1732212452828254270","https://twitter.com/ebcnarede/status/1732212452828254270","1732212452828254270","DEMOCRACIA | A regulamentação das redes sociais e das big techs (que são as grandes empresas de tecnologia e inovação), o uso responsável da Inteligência Artificial e o combate à desinformação foram assuntos debatidos em um seminário promovido pela EBC e pela FGV, no RJ. https://t.co/1fFRDGAZYD","13","3","31","1","Wed Dec 06 01:36:46 +0000 2023","2","false","false"
"https://x.com/Leoz3ra_/status/1732238855242224035","https://twitter.com/Leoz3ra_/status/1732238855242224035","1732238855242224035","inteligencia artificial é algo revolucionario galera cuidado pra nao perderem seus empregos https://t.co/rHZpwYLDJz","0","4","10","0","Wed Dec 06 03:21:41 +0000 2023","0","false","false"
"https://x.com/necrofagista/status/1732434535369859236","https://twitter.com/necrofagista/status/1732434535369859236","1732434535369859236","pássaro gerado por inteligência artificial q porra é essa","1","4","21","0","Wed Dec 06 16:19:14 +0000 2023","0","false","false"
"https://x.com/LightningRj21/status/1732465434962649145","https://twitter.com/LightningRj21/status/1732465434962649145","1732465434962649145","Fiz uma foto minha com inteligência artificial e não é que ficou legal 🤩 https://t.co/9vgzi4uZgz","2","21","83","0","Wed Dec 06 18:22:02 +0000 2023","0","false","false"
"https://x.com/lola19803789/status/1732259331477733526","https://twitter.com/lola19803789/status/1732259331477733526","1732259331477733526","Em algum lugar da África, uma conferência sobre inteligência artificial. 😃😅 https://t.co/Lz6wfancBu","1","0","1","0","Wed Dec 06 04:43:03 +0000 2023","0","false","false"
"https://x.com/talis_suonoda/status/1732546441057316906","https://twitter.com/talis_suonoda/status/1732546441057316906","1732546441057316906","se a rodinha ainda existisse eu ia barbarizar agora https://t.co/tFyMMhgZto","56","20","764","8","Wed Dec 06 23:43:55 +0000 2023","55","false","false"
"https://x.com/Equalizartes/status/1732546968495284478","https://twitter.com/Equalizartes/status/1732546968495284478","1732546968495284478","QUARTA DO DIVULGUE SUA ARTE 🎭
Eu quase esqueci! E estou muito exausto pra pensar numa piada, mas vc ja sabe como funciona!
🚫 IA / NF-T https://t.co/dUZ0tFNSoO","51","113","259","2","Wed Dec 06 23:46:01 +0000 2023","6","false","false"
"https://x.com/mbttncrt_/status/1732545244124651803","https://twitter.com/mbttncrt_/status/1732545244124651803","1732545244124651803","ainda bem que sei que a agatha vai morrer amanhã porque senão essa conversa dela com o ramiro ia me dar no mínimo umas três paralisias do sono https://t.co/myazkLc2Il","4","1","18","1","Wed Dec 06 23:39:09 +0000 2023","0","false","false"
"https://x.com/rituaryas/status/1732548958260478279","https://twitter.com/rituaryas/status/1732548958260478279","1732548958260478279","eu achando que ia ser kelmiro ai cortam pra casal hétero transando EU NÃO AGUENTO MAISSSS #TerraEPaixão https://t.co/VN6axPEkDs","29","1","173","1","Wed Dec 06 23:53:55 +0000 2023","4","false","false"
"https://x.com/lucasbarrosd_/status/1732550471028470155","https://twitter.com/lucasbarrosd_/status/1732550471028470155","1732550471028470155","assistindo bottoms e achei que ia ser bem melhor pelo hype todo que colocaram https://t.co/zLVqU7LNwW","9","15","178","12","Wed Dec 06 23:59:56 +0000 2023","5","false","false"
"https://x.com/Jigokusoiree/status/1732546717097042083","https://twitter.com/Jigokusoiree/status/1732546717097042083","1732546717097042083","Não meus amores, mas tava falando de galante com o @Thulin30 e achei essa fanart aqui, porra... Essa aqui a Syndra ia servir viu, porra eu não vou mentir eu odeio essa linha mas eu teria que deitar e rolar pra uma Syndra nela assim

Art by: Piscina 幻夢池 - Artstation https://t.co/MwLv1bMpLg","1","7","17","2","Wed Dec 06 23:45:01 +0000 2023","0","false","false"
"https://x.com/vascoonha/status/1732550176944910700","https://twitter.com/vascoonha/status/1732550176944910700","1732550176944910700","no meio da faxina decidi que conseguia e ia subir em cima da minha casa pra limpa a janela mas eu travei de medo e nao cosnegui mais subi nem desce kkkkhkkhkkvsf os vizinho vieram ate oferece ajudakkkk https://t.co/Xc1djQOeEG","0","1","8","0","Wed Dec 06 23:58:46 +0000 2023","0","false","false"
"https://x.com/Gathsanach/status/1732550009936040406","https://twitter.com/Gathsanach/status/1732550009936040406","1732550009936040406","Sería tão bom se o Bahia pelo menos empatasse e o Vasco perdesse hoje, ia calar a boca de tanta gente, só pensando aqui https://t.co/Rzq9F4FDTm","0","0","3","0","Wed Dec 06 23:58:06 +0000 2023","0","false","false"
"https://x.com/SthepWisp/status/1732550388979540066","https://twitter.com/SthepWisp/status/1732550388979540066","1732550388979540066","@oraculoofertas Eu jurava que não ia conseguir KKKKKKKKKKK https://t.co/6bqRVMssAB","2","2","5","0","Wed Dec 06 23:59:36 +0000 2023","0","false","false"
"https://x.com/acidigital/status/1732548425650942450","https://twitter.com/acidigital/status/1732548425650942450","1732548425650942450","Um padre católico nigeriano da diocese de Okigwe foi sequestrado no dia 30 de novembro quando ia ministrar o sacramento da Unção dos Enfermos a um paroquiano.

A diocese anunciou no dia 1º de dezembro que o padre Kingsley Eze foi sequestrado por volta das 20h e que seu paradeiro ainda era desconhecido.

📌Leia na íntegra:https://t.co/lFXkuuugEE  #acidigital","18","2","59","0","Wed Dec 06 23:51:48 +0000 2023","0","false","false"
"https://x.com/onlyrchtr/status/1732545299166433689","https://twitter.com/onlyrchtr/status/1732545299166433689","1732545299166433689","a agatha tipo cagando pra história que era o filho dela que ia morrer https://t.co/XSwxbdzHW7","10","0","38","0","Wed Dec 06 23:39:23 +0000 2023","0","false","false"
"https://x.com/tvimperial7/status/1732548667918172300","https://twitter.com/tvimperial7/status/1732548667918172300","1732548667918172300","👑 Qualquer coisa seria melhor do que o que foi feito. #historia #curiosidadesdahistoria #memeshistoricos #ia #ai #inteligenciaartificial #artificialintelligence #arquitetura https://t.co/YvbJZdS1Vy","21","5","132","0","Wed Dec 06 23:52:46 +0000 2023","5","false","false"
"https://x.com/Amavel_Lb3/status/1732547630532587670","https://twitter.com/Amavel_Lb3/status/1732547630532587670","1732547630532587670","falei o ano todo que ia juntar dinheiro, chegou dezembro e eu não tenho 1 real 😂😂😂","21","0","3","6","Wed Dec 06 23:48:38 +0000 2023","0","false","false"
"https://x.com/melzera__/status/1732549608608321917","https://twitter.com/melzera__/status/1732549608608321917","1732549608608321917","se tivesse 200 shows de devinho, eu ia pra todos com a mesma animação como se fosse o primeiro 🤴","5","1","7","0","Wed Dec 06 23:56:30 +0000 2023","0","false","false"
"https://x.com/hpufal/status/1732544978797076896","https://twitter.com/hpufal/status/1732544978797076896","1732544978797076896","Acabo de ser abordado por um vendedor de pipoca dentro do Beira-Rio perguntando em quem eu ia votar e argumentando a favor do Melo. Compraram dos influenciadores aos vendedores de pipoca. https://t.co/HtyTEkcXfD","3","3","10","0","Wed Dec 06 23:38:06 +0000 2023","0","false","false"
"https://x.com/qgperronito/status/1732544364864274742","https://twitter.com/qgperronito/status/1732544364864274742","1732544364864274742","@dmfavorites Ela não ia se estressar com a recaída desse povo. Sem tempo, irmão https://t.co/eQvZKE4OoJ","1","0","46","0","Wed Dec 06 23:35:40 +0000 2023","1","false","false"
"https://x.com/HenricoRoberto/status/1732544925948956820","https://twitter.com/HenricoRoberto/status/1732544925948956820","1732544925948956820","Falei pra mim msm q ia parar de fumar… mas tô com tanto problema, tanta coisa na minha cabeça, que pra eu n fazer merda, acendo meu cigarrinho… pqp🤯","2","2","10","0","Wed Dec 06 23:37:54 +0000 2023","0","false","false"
"https://x.com/felpin90s/status/1732550439676100776","https://twitter.com/felpin90s/status/1732550439676100776","1732550439676100776","eu sabia q ele ia fazer isso https://t.co/udJiFTjwFV","6","1","90","0","Wed Dec 06 23:59:48 +0000 2023","0","false","false"
"https://x.com/absol_shiny1204/status/1732188235714216143","https://twitter.com/absol_shiny1204/status/1732188235714216143","1732188235714216143","Me sinto um velho conservador toda vez q vejo meu irmão usando chatgpt pra fazer os trabalhos dele","0","1","6","0","Wed Dec 06 00:00:32 +0000 2023","0","false","false"
"https://x.com/revistaforum/status/1732547937270440038","https://twitter.com/revistaforum/status/1732547937270440038","1732547937270440038","Gemini: Nova ferramenta de IA do Google chega para competir com ChatGPT

Leia mais: https://t.co/AUlmkjzoHQ https://t.co/r22IoYgnZ6","0","1","8","0","Wed Dec 06 23:49:52 +0000 2023","0","false","false"
"https://x.com/HeiArthuro/status/1732431053988532415","https://twitter.com/HeiArthuro/status/1732431053988532415","1732431053988532415","Pedi pro ChatGPT fazer um programa pra mim e ele realmente funcionou. O resultado era uma bosta, mas funcionou.","0","0","4","0","Wed Dec 06 16:05:24 +0000 2023","0","false","false"
"https://x.com/gabiszpc/status/1732456160978931864","https://twitter.com/gabiszpc/status/1732456160978931864","1732456160978931864","jornalistas vão acabar em 12 meses por causa do chatgpt!!","0","2","5","0","Wed Dec 06 17:45:10 +0000 2023","0","false","false"
"https://x.com/aitoexausta_/status/1732518310896435700","https://twitter.com/aitoexausta_/status/1732518310896435700","1732518310896435700","o professor que orientou minha IC HUMILHOU o cara no grupo de orientandos porque ele plagiou TCC e IC de outras pessoas pra fazer o doutorado dele. ainda bem que ele não descobriu que eu usei um tantinho assim 🫸                                      🫷 de ChatGPT no meu relatório","0","0","3","0","Wed Dec 06 21:52:08 +0000 2023","0","false","false"
"https://x.com/cegadede/status/1732538332691747085","https://twitter.com/cegadede/status/1732538332691747085","1732538332691747085","O bard é mais incrível que o chatGPT","5","53","374","6","Wed Dec 06 23:11:42 +0000 2023","103","false","false"
"https://x.com/luaaaanzin/status/1732366768935448775","https://twitter.com/luaaaanzin/status/1732366768935448775","1732366768935448775","depois que comecei usar o chatgpt pra responder email do trampo nunca mais fui grosso","0","2","8","0","Wed Dec 06 11:49:58 +0000 2023","0","false","false"
"https://x.com/brjisa/status/1732194545452954034","https://twitter.com/brjisa/status/1732194545452954034","1732194545452954034","eu acho que vocês que pedem por favor pra Alexa e ChatGPT serão responsáveis pela destruição da raça humana 
não se pede por favor pra um ROBÔ","0","9","11","0","Wed Dec 06 00:25:36 +0000 2023","0","false","false"
"https://x.com/RPGuaxa/status/1732407223408591139","https://twitter.com/RPGuaxa/status/1732407223408591139","1732407223408591139","Dica pra ser um narrador incrível igual o @marceloguaxinim :

1- a história não é sua, deixe os jogadores ajudar a conta-la.
 2-Pós produção, um editor pra cortar tudo que vc falou errado, sua gagueira aquele momento que vc foi no chatgpt sortear uns nome de npc, trilha sonora...","2","2","24","1","Wed Dec 06 14:30:43 +0000 2023","0","false","true"
"https://x.com/laripacheco_/status/1732501275109974032","https://twitter.com/laripacheco_/status/1732501275109974032","1732501275109974032","Como eu amo o chatGPT que negócio incrível, sério","1","1","4","0","Wed Dec 06 20:44:26 +0000 2023","0","false","false"
"https://x.com/quimers_/status/1732520831333347355","https://twitter.com/quimers_/status/1732520831333347355","1732520831333347355","me peguei pensando aqui em como vai ser mais difícil o trabalho de acadêmico de simulação diplomática na hora de corrigir guia em plena era de chatgpt","0","0","3","0","Wed Dec 06 22:02:09 +0000 2023","0","false","false"
"https://x.com/lorenadozap/status/1732417431044510014","https://twitter.com/lorenadozap/status/1732417431044510014","1732417431044510014","nunca usei o chatGPT eu me recuso ME RECUSO","0","1","5","0","Wed Dec 06 15:11:16 +0000 2023","0","false","false"
"https://x.com/GB_Ramone/status/1732207589784502423","https://twitter.com/GB_Ramone/status/1732207589784502423","1732207589784502423","Cara, to com tanto sono, que to no automático. 
To mandando o chatGPT fazer e só to testando pra ver se n ta bugado. kkkkkkkkkkkkkkkkkkk https://t.co/IJ8JKsFdaQ","0","0","2","0","Wed Dec 06 01:17:26 +0000 2023","0","false","false"
"https://x.com/Metropoles/status/1732436238051786873","https://twitter.com/Metropoles/status/1732436238051786873","1732436238051786873","➡️ Google lança Gemini, sistema de IA mais potente; veja como funciona.

Gemini poderá ser testado no Google Bard, chatbot de IA criado pela companhia para concorrer com o ChatGPT, da OpenAI.

Leia: https://t.co/JqP2GLcmEw https://t.co/8tYnLpbPac","2","0","12","0","Wed Dec 06 16:26:00 +0000 2023","0","false","false"
"https://x.com/LucasFirenzzi/status/1732480686425014553","https://twitter.com/LucasFirenzzi/status/1732480686425014553","1732480686425014553","Cara, Chat GPT, resume pra mim o que é uma ditadura em 5 tópicos. Se liga na resposta:

1- Regime antidemocrático onde todos os poderes do Estado estão concentrados em um indivíduo, um grupo ou um partido. Este poder é exercido sem respeitar os princípios constitucionais democráticos, e a participação da população é inexistente ou extremamente limitada​.  

2- O ditador ou o grupo no poder exerce controle absoluto, frequentemente pela força ou fraude, e não admite oposição a seus atos e ideias. Qualquer forma de oposição política ou desafio ao regime é reprimida, muitas vezes através de medidas como censura e perseguição política.  

3- As liberdades individuais são frequentemente suprimidas em uma ditadura. Isso inclui a liberdade de expressão, a liberdade de imprensa, e outras liberdades civis. Os espaços de comunicação e deliberação são fortemente regulados ou completamente suprimidos​.  

4- Em ditaduras o poder político é absoluto e ilimitado, concentrando-se nas mãos de um único indivíduo, partido ou grupo, muitas vezes com uma inclinação militar. Essa centralização do poder implica pouca ou nenhuma abertura para o debate político ou participação pública.  

5- Em muitas ditaduras, o poder é exercido com o apoio de um único partido político, cuja ideologia é considerada a única correta. Outros partidos políticos são frequentemente proibidos ou severamente limitados.","71","8","295","7","Wed Dec 06 19:22:38 +0000 2023","11","false","false"
"https://x.com/sbtnews/status/1732521479852511489","https://twitter.com/sbtnews/status/1732521479852511489","1732521479852511489","Contra ChatGPT, Google anuncia a inteligência artificial Gemini #sbtnews  https://t.co/2vkV02HDtQ https://t.co/8xS6RoqEb7","0","0","4","0","Wed Dec 06 22:04:44 +0000 2023","0","false","false"
"https://x.com/gft_br/status/1732375877017604210","https://twitter.com/gft_br/status/1732375877017604210","1732375877017604210","Já faz um ano que a OpenAI lançou o ChatGPT. Trata-se de um assistente virtual que utiliza IA para interagir e fornecer suporte em uma ampla variedade de tarefas e contextos.

Quais são os principais benefícios da utilização do ChatGPT?

#GFTBrasil #ChatGPT #EnqueteGFT","0","0","4","0","Wed Dec 06 12:26:09 +0000 2023","0","false","false"
"https://x.com/Avou_cansei/status/1732384480868859960","https://twitter.com/Avou_cansei/status/1732384480868859960","1732384480868859960","Tivemos um problema com as coordenadas das fotos q sumiram do arquivo. A moça tava tendo q abrir cada foto, digitar as coordenas e aí copiar pra planilha. A ideia brilhante foi mandar as 140 fotos pro chatgpt mandando ele copiar de cada foto pra uma lista. Foi um sucesso bizarro","0","3","4","0","Wed Dec 06 13:00:21 +0000 2023","0","false","false"
"https://x.com/CNNEconomia/status/1732500337972449494","https://twitter.com/CNNEconomia/status/1732500337972449494","1732500337972449494","Google lança Gemini, plataforma de IA para competir com ChatGPT; entenda
https://t.co/JIJxU44aRV","4","2","12","1","Wed Dec 06 20:40:43 +0000 2023","1","false","false"
"https://x.com/manodocreu/status/1732426326626156607","https://twitter.com/manodocreu/status/1732426326626156607","1732426326626156607","sempre mantenho respeito com o chatgpt pq não quero q ele me mat3 ❤️","0","1","9","0","Wed Dec 06 15:46:37 +0000 2023","0","false","false"
"https://x.com/MattHells/status/1732197355053576674","https://twitter.com/MattHells/status/1732197355053576674","1732197355053576674","@PeraltaSnow É muito Midjourney!

O artista poderia ter feito uma arte, do zero, BASEADA nessa imagem da IA. Mas eu posso te dizer com tranquilidade que eles só manipularam a imagem do Midjourney em Photoshop.","0","1","1","0","Wed Dec 06 00:36:46 +0000 2023","0","false","false"
"https://x.com/Mariade22366064/status/1732524482047131660","https://twitter.com/Mariade22366064/status/1732524482047131660","1732524482047131660","@dvorahfr @midjourney @javilopen @runwayml @capcutapp Sem palavras","0","0","1","0","Wed Dec 06 22:16:39 +0000 2023","0","false","false"
"https://x.com/julions/status/1732533029329916068","https://twitter.com/julions/status/1732533029329916068","1732533029329916068","@nicholaspretto bota no midjourney “agora mais psicodélico” e assim por diante","0","0","1","0","Wed Dec 06 22:50:37 +0000 2023","0","false","false"
"https://x.com/ZION_CYBER1/status/1732410613195014228","https://twitter.com/ZION_CYBER1/status/1732410613195014228","1732410613195014228","Se sua conta for invadida ou adulterada, tudo o que você precisa é de um bom hacker...
Caixa de entrada agora para todos os serviços de hacking
#Hacked #icloud #snapchat
#Discord
#Roblox #telefone ausen
#privacidade
#CyberSecurity #cyberattack
#Linux
#MachineLearning #brasileira https://t.co/VJDzJhWVUu","0","0","0","0","Wed Dec 06 14:44:11 +0000 2023","0","false","false"
