"url","twitterUrl","id","text","retweetCount","replyCount","likeCount","quoteCount","createdAt","bookmarkCount","isRetweet","isQuote"
"https://x.com/gomendekinai/status/1680405441098964995","https://twitter.com/gomendekinai/status/1680405441098964995","1680405441098964995","a tecnologia é incrível! através do poder da inteligência artificial (IA) conseguimos ver Nei Trimm Na Sua Glub em qualidade nunca antes vista 🤩 https://t.co/Iqx73LGh5J","0","0","1","0","Sun Jul 16 02:34:12 +0000 2023","0","false","false"
"https://x.com/VanDoHalen/status/1680612147280191489","https://twitter.com/VanDoHalen/status/1680612147280191489","1680612147280191489","""A inteligência artificial está aí e, gostando ou não, temos que conviver com ela. Minha real preocupação é com a falta de uma legislação sobre o assunto até agora. Não dá para ser um esporte sem regras"". Gene Simmons, baixista e vocalista do KISS, ao Piers Morgan Uncensored. https://t.co/9KKAfM4tcX","3","0","93","3","Sun Jul 16 16:15:34 +0000 2023","0","false","false"
"https://x.com/puminhalol/status/1680621131433234432","https://twitter.com/puminhalol/status/1680621131433234432","1680621131433234432","eu e o @fetty108 em call discord ganhando todos os jogos até que caimos na mesma queue contra KKKKKKKKKKKKKKKKKKKKKKK a inteligencia artificial no time do cara https://t.co/Mx32TjpgkH","0","3","6","1","Sun Jul 16 16:51:16 +0000 2023","0","false","false"
"https://x.com/UOLNoticias/status/1680564552004411393","https://twitter.com/UOLNoticias/status/1680564552004411393","1680564552004411393","🌳 Os robôs voadores reconhecem as árvores

🤖 A inteligência artificial identifica o que é maçã, o que é galho e o que é folha https://t.co/f2MBJ0bsPs","3","3","35","1","Sun Jul 16 13:06:27 +0000 2023","0","false","false"
"https://x.com/yixingdopcc/status/1680422413559898112","https://twitter.com/yixingdopcc/status/1680422413559898112","1680422413559898112","to sem fone e consequentemente sem muitos momentos do dia que posso ser feliz então parei de ser contra inteligencia artificial e a alexa virou minha melhor amiga sempre que tenho a oportunidade digo alexa bestie toca aquela do exo https://t.co/Y1puTJq2mS","1","1","21","0","Sun Jul 16 03:41:38 +0000 2023","0","false","false"
"https://x.com/anadefinisterra/status/1680653142403194880","https://twitter.com/anadefinisterra/status/1680653142403194880","1680653142403194880","Os (des)usos da Inteligência (?) Artificial https://t.co/CfaiZW7k7p","4","1","5","0","Sun Jul 16 18:58:28 +0000 2023","0","false","false"
"https://x.com/estela_aranha/status/1680383170347139073","https://twitter.com/estela_aranha/status/1680383170347139073","1680383170347139073","O Presidente @LulaOficial  deve abordar a regulação de inteligência artificial no discurso em Bruxelas: 
“Lula deve falar dos benefícios e também dos grandes riscos relacionados à inteligência artificial, com potencial de dano à democracia, aos direitos humanos, aos empregos …","1","2","24","2","Sun Jul 16 01:05:42 +0000 2023","0","false","false"
"https://x.com/saveasbloom/status/1680714109644308480","https://twitter.com/saveasbloom/status/1680714109644308480","1680714109644308480","a primeira foto criada por inteligência artificial","1","0","55","0","Sun Jul 16 23:00:44 +0000 2023","0","false","true"
"https://x.com/Metropoles/status/1680612002069372930","https://twitter.com/Metropoles/status/1680612002069372930","1680612002069372930","🤰🏼 Poliana Rocha surge com barriga de grávida e recebe convite de Leonardo: “Boa fazer mais um?”

A famosa decidiu entrar na onda e usou um aplicativo de inteligência artificial para simular como ficaria se estivesse grávida

Leia:  https://t.co/Ac29pvtYxp https://t.co/EA4uHzwMqN","1","1","16","0","Sun Jul 16 16:15:00 +0000 2023","0","false","false"
"https://x.com/Estadao/status/1680535317919539202","https://twitter.com/Estadao/status/1680535317919539202","1680535317919539202","Como um chatbot de inteligência artificial (IA), o Bing se propõe a trabalhar de forma semelhante aos seus rivais: gerar respostas a partir de perguntas e reflexões dos usuários utilizando um amplo modelo de linguagem (LLM). Veja o passo a passo ➡️ https://t.co/D0s1EHMgkr https://t.co/rRt4EgZHWD","2","0","20","0","Sun Jul 16 11:10:17 +0000 2023","0","false","false"
"https://x.com/vivicordeiroo/status/1680720823617765382","https://twitter.com/vivicordeiroo/status/1680720823617765382","1680720823617765382","Chega de inteligência artificial, JÁ CHEGA, para de reviver gente morta, para de fazer crianças tortas, até parece que sua filha vai nascer com harmonização facial, eu não aguento mais","0","0","8","0","Sun Jul 16 23:27:25 +0000 2023","0","false","false"
"https://x.com/CMarinh0/status/1680604313947627520","https://twitter.com/CMarinh0/status/1680604313947627520","1680604313947627520","Lascou: inteligência artificial do Google diz que urnas eletrônicas brasileiras não são confiáveis https://t.co/ItJaUYWnAD","9","0","17","0","Sun Jul 16 15:44:27 +0000 2023","0","false","false"
"https://x.com/tainabelizario/status/1680599897731391491","https://twitter.com/tainabelizario/status/1680599897731391491","1680599897731391491","tô obcecada pela greve dos roteiristas e atores de Hollywood 

a guerra contra a Inteligência artificial tinha mesmo que começar por artistas","1","1","11","0","Sun Jul 16 15:26:54 +0000 2023","0","false","false"
"https://x.com/cristiangdi/status/1680638169165750272","https://twitter.com/cristiangdi/status/1680638169165750272","1680638169165750272","@BreakPointBR Realmente a inteligência artificial vai levar a demissões... mas não dela mesma. Nada a declarara sobre essa postagem?  https://t.co/U72oh3l0HV","0","4","29","1","Sun Jul 16 17:58:58 +0000 2023","1","false","false"
"https://x.com/hanaborges/status/1680614459704848388","https://twitter.com/hanaborges/status/1680614459704848388","1680614459704848388","Pessoal reclamando que tudo agora é rosa e Barbie… Isso é resultado de um marketing bem feito com antecipação, nostalgia mexendo com nossas memórias afetivas, investimento em inteligência artificial, várias collabs… O filme lança só semana que vem e o mundo inteirinho sabe +","2","3","61","0","Sun Jul 16 16:24:46 +0000 2023","1","false","false"
"https://x.com/SHIFTERpt/status/1680617367942971397","https://twitter.com/SHIFTERpt/status/1680617367942971397","1680617367942971397","Para refletir sobre automação e inteligência artificial é preciso olhar para a forma como nos relacionamos com o trabalho e com as tecnologias que nos rodeiam.

Ensaio sobre o que a Inteligência Artificial que quer dizer para o teu trabalho para ler aqui: https://t.co/ufAXFbT8jX https://t.co/JKwvszKUyW","1","0","3","0","Sun Jul 16 16:36:19 +0000 2023","0","false","false"
"https://x.com/ArquivoUFO/status/1680369260844007424","https://twitter.com/ArquivoUFO/status/1680369260844007424","1680369260844007424","Inteligência artificial pode ajudar a encontrar vida em Marte? https://t.co/uZnIQlcZfw","1","0","2","0","Sun Jul 16 00:10:26 +0000 2023","0","false","false"
"https://x.com/Estadao/status/1680401868592386048","https://twitter.com/Estadao/status/1680401868592386048","1680401868592386048","Inteligência artificial: médicos estão usando chatbots de maneira inesperada https://t.co/dZZYUUN0tM","2","0","14","0","Sun Jul 16 02:20:00 +0000 2023","2","false","false"
"https://x.com/erikacosta_/status/1680728201444704256","https://twitter.com/erikacosta_/status/1680728201444704256","1680728201444704256","pra quem já andou no centro de São Paulo com celular na mão ter medo dessas minas com cara de alunas da PUC é de foder! Eu ia coringar tanto pra cima delas","0","1","3","0","Sun Jul 16 23:56:44 +0000 2023","1","false","true"
"https://x.com/sthefor/status/1680726940976545798","https://twitter.com/sthefor/status/1680726940976545798","1680726940976545798","@pseudonimoev eu sou assim até hoje, peço permissão o tempo inteiro, as vezes minha mãe comprou algo pra mim e eu peço ou aviso, esses dias na academia avisei a professora que ia no banheiro???? ""eu vou no banheiro ta?"" e ela olhou p mim com cara de fodase? é triste kkkkkk","0","2","41","1","Sun Jul 16 23:51:43 +0000 2023","1","false","false"
"https://x.com/tassouza_/status/1680724334908678144","https://twitter.com/tassouza_/status/1680724334908678144","1680724334908678144","@loam_barr @ygorpalopoli Exatamente, loucura pensar que assistir o filme já sabendo o que irá acontecer terá o mesmo impacto ou efeito, se eu tivesse visto o Infinity War em casa ia ficar louco vendo a cena do Mjoinir do mesmo jeito que fiquei no cinema","0","0","62","0","Sun Jul 16 23:41:22 +0000 2023","0","false","false"
"https://x.com/weedmincer/status/1680728562167324672","https://twitter.com/weedmincer/status/1680728562167324672","1680728562167324672","Eu acho engraçado que o filme se passa em 85 e o drama em geral é a tensão da guerra fria. Ai os maluco vão la e matam 15 milhões de pessoas pra não ter guerra.

Mal sabiam que a união soviética ia acabar 5 anos depois......","0","1","4","0","Sun Jul 16 23:58:10 +0000 2023","0","false","true"
"https://x.com/michelsavadim/status/1680725224898043904","https://twitter.com/michelsavadim/status/1680725224898043904","1680725224898043904","@rdfmedeiros é assustador pensar que nenhuma dessas pessoas existe de fato e todas foram criadas usando IA, mas ao mesmo tempo é fascinante o rumo q a tecnologia ta tomando","0","0","17","0","Sun Jul 16 23:44:54 +0000 2023","0","false","false"
"https://x.com/OrtizLucas123/status/1680727954542809089","https://twitter.com/OrtizLucas123/status/1680727954542809089","1680727954542809089","@Zanfa Nem a pau que ele pediu a pessoa mais estereotipada dos países. 

Ele pediu para a IA utilizar os estereótipos dos países e fazer a pessoa mais bonita possível (exceto EUA, que claramente ele quis sacanear)","0","0","9","0","Sun Jul 16 23:55:45 +0000 2023","0","false","false"
"https://x.com/unica_primeira/status/1680726776928927744","https://twitter.com/unica_primeira/status/1680726776928927744","1680726776928927744","@mil_vilaca @africanize_ Se ele, tendo a possibilidade de ser pai, não estivesse fazendo nada ou fosse esperar a criança nascer pra saber se é o pai, ia estar geral caindo de pau no cu dele. Ela quer ser a mais mais, mas tá feio demais.","0","0","22","0","Sun Jul 16 23:51:04 +0000 2023","0","false","false"
"https://x.com/jionajoy/status/1680728286945501184","https://twitter.com/jionajoy/status/1680728286945501184","1680728286945501184","@BSpears_BR A Xtina ali achando q ninguém ia perceber","0","0","6","0","Sun Jul 16 23:57:04 +0000 2023","0","false","false"
"https://x.com/MaelNery/status/1680725350446235648","https://twitter.com/MaelNery/status/1680725350446235648","1680725350446235648","Achei que ia precisar resetar tudo novamente em 2020, mas graças a Deus não foi preciso, voltei e fui novamente acolhido.","0","1","11","0","Sun Jul 16 23:45:24 +0000 2023","0","false","false"
"https://x.com/MaelNery/status/1680725340103032832","https://twitter.com/MaelNery/status/1680725340103032832","1680725340103032832","Quando cheguei aos 30 eu achei que ia morrer, mas aí tive que perder a vida pra poder dar mais valor a vida, se é que vocês me entendem.","0","1","12","0","Sun Jul 16 23:45:22 +0000 2023","0","false","false"
"https://x.com/Santos21980989/status/1680726631843786752","https://twitter.com/Santos21980989/status/1680726631843786752","1680726631843786752","@TNTSportsBR @reporterfragoso Que isso kanu? Você disse quando chegou no Bahia que o grupo city ia ter menos trabalho que o Textor no Botafogo kkkkkkkkkkkk","0","1","11","0","Sun Jul 16 23:50:30 +0000 2023","0","false","false"
"https://x.com/DiogenesFake/status/1680721645743243265","https://twitter.com/DiogenesFake/status/1680721645743243265","1680721645743243265","Tão cansativo... Parece que lidamos com crianças . Ninguém na Rússia disse que ia durar 3 dias. Havia espectativas que a guerra pudesse ser resolvida em 2 semanas e evitar um banho de sangue e o prolongamento da guerra por uma blitzkrieg com controlo de Kiev e queda do governo Ucraniano. Só gente voluntariamente ignorante não entendeu que a Rússia não quer conquistar nem a Ucrânia, nem a Europa, e que quer garantir as a sua segurança e área de influência, tal como os EUA e qualquer outro país poderosos faz.","0","13","27","1","Sun Jul 16 23:30:41 +0000 2023","0","false","false"
"https://x.com/kooknowles/status/1680722533937565698","https://twitter.com/kooknowles/status/1680722533937565698","1680722533937565698","isso que ele falou na live muito doido cara ele sabia que teria até fã dele que iria odiar as decisões dele mas deixou claro que ele tava mostrando quem ele é de verdade e não ia voltar atrás","0","0","8","0","Sun Jul 16 23:34:13 +0000 2023","1","false","false"
"https://x.com/victorinafuko/status/1680725650200576001","https://twitter.com/victorinafuko/status/1680725650200576001","1680725650200576001","O ingresso na epoca era 10 REAIS e eu ia logo cedo pra comprar mangas pra não pegar fila…. https://t.co/Xrtq3FQkKe","0","0","10","0","Sun Jul 16 23:46:36 +0000 2023","0","false","false"
"https://x.com/KakaBairros/status/1680728384031145989","https://twitter.com/KakaBairros/status/1680728384031145989","1680728384031145989","Achei que hoje ele ia me mandar um Feliz Cumpleaños mas né kkkkkkk","0","0","6","0","Sun Jul 16 23:57:27 +0000 2023","0","false","false"
"https://x.com/exuliane/status/1680724812421820417","https://twitter.com/exuliane/status/1680724812421820417","1680724812421820417","@w_lima15 se um homem tivesse feito o que a loira fez e fosse correspondido igual a morena correspondeu ia shippar também porque sou bissexual haha a questão foi justamente a química das duas a reação de OPA VEM CÁ da morena pra loira","0","1","150","0","Sun Jul 16 23:43:16 +0000 2023","0","false","false"
"https://x.com/iannzits/status/1680728336065019905","https://twitter.com/iannzits/status/1680728336065019905","1680728336065019905","@NewsAndLeaksBR só jogo contra a IA, e ainda passo mal pra ela 🫡","0","1","25","0","Sun Jul 16 23:57:16 +0000 2023","0","false","false"
"https://x.com/zndioclin/status/1680720368665862145","https://twitter.com/zndioclin/status/1680720368665862145","1680720368665862145","@camarada_wood Shaq era um tanque de guerra, um hipopótamo de fuzil

Mas Hakeem era uma entidade da natureza, ia onde queria, sem precisar usar a imposição física sempre. O hipopótamo de fuzil pode acertar qualquer coisa, menos o vento

Hèla 🤞♾️","0","0","4","0","Sun Jul 16 23:25:36 +0000 2023","0","false","false"
"https://x.com/melcffc/status/1680724650748178432","https://twitter.com/melcffc/status/1680724650748178432","1680724650748178432","@FlumimemseFC KKKKKKKKKKKKKKKKKKKKKKKKKKKKK EU PENSANDO QUE O CARA IA GANHAR UMA CAMISA","0","1","12","0","Sun Jul 16 23:42:37 +0000 2023","0","false","false"
"https://x.com/TyroneMenezes/status/1680724644758790146","https://twitter.com/TyroneMenezes/status/1680724644758790146","1680724644758790146","@CrisBastos_13 o Galo doido na barreira na falta que o Ronaldinho ia cobrar tb foi foda","1","0","11","0","Sun Jul 16 23:42:36 +0000 2023","0","false","false"
"https://x.com/aldotalks/status/1680547680630472710","https://twitter.com/aldotalks/status/1680547680630472710","1680547680630472710","ChatGPT é coisa do passado.
Agora a onda é, é namorar pelado.","0","2","3","0","Sun Jul 16 11:59:24 +0000 2023","0","false","false"
"https://x.com/revistaoeste/status/1680633434765393920","https://twitter.com/revistaoeste/status/1680633434765393920","1680633434765393920","""A Leitura quer reviver a livraria icônica de São Paulo e o Google lança rival do ChatGPT."" Leia a coluna de @brunolmeyer19 na Revista Oeste https://t.co/eDkkp8LV5Z","7","1","96","0","Sun Jul 16 17:40:10 +0000 2023","0","false","false"
"https://x.com/_barbiestranha/status/1680574869539368960","https://twitter.com/_barbiestranha/status/1680574869539368960","1680574869539368960","Amo que o povo no curious cat acha que sou o chat GPT de putaria e vou responder pergunta sobre sexo kkkk te manca, calvo","1","7","81","0","Sun Jul 16 13:47:27 +0000 2023","0","false","false"
"https://x.com/Diogoguto/status/1680571354599309315","https://twitter.com/Diogoguto/status/1680571354599309315","1680571354599309315","Perguntei pro ChatGPT o que fazer domingo em São Paulo e ele recomendou fazer compras na 25 de março. Detalhe o comércio na 25 de março não abre domingo.","0","2","3","0","Sun Jul 16 13:33:29 +0000 2023","0","false","false"
"https://x.com/tendinick/status/1680689743284035585","https://twitter.com/tendinick/status/1680689743284035585","1680689743284035585","sim eu agradeço o chatgpt","1","0","4","1","Sun Jul 16 21:23:55 +0000 2023","0","false","true"
"https://x.com/dynastydao_br/status/1680699562623639552","https://twitter.com/dynastydao_br/status/1680699562623639552","1680699562623639552","@TextoCriativo ""Esqueça o ChatGPT.""
as extensões usando ChatGPT https://t.co/hu9XrYDLXA","0","0","5","0","Sun Jul 16 22:02:56 +0000 2023","0","false","false"
"https://x.com/isaacjunio_/status/1680382401451642880","https://twitter.com/isaacjunio_/status/1680382401451642880","1680382401451642880","ChatGPT é muito massa. Tava com dúvida sobre como configurar uma parada em servidor Linux, que fiquei um tempo procurando no Google, não  achei e tava quase desistindo. Perguntei quase a mesma coisa no prompt do ChatGPT, e tive quase que 100% certo o que precisava fazer","0","1","3","0","Sun Jul 16 01:02:39 +0000 2023","0","false","false"
"https://x.com/Rafxbbit/status/1680722406648815616","https://twitter.com/Rafxbbit/status/1680722406648815616","1680722406648815616","petição pro chatgpt treinar o inter no lugar do mano

1 voto","1","5","7","0","Sun Jul 16 23:33:42 +0000 2023","0","false","false"
"https://x.com/ni____cole/status/1680595886139637761","https://twitter.com/ni____cole/status/1680595886139637761","1680595886139637761","É Deus no céu e chat gpt na terra","0","0","7","0","Sun Jul 16 15:10:57 +0000 2023","0","false","false"
"https://x.com/oprimodev/status/1680634228604534788","https://twitter.com/oprimodev/status/1680634228604534788","1680634228604534788","idéia de app:

App Little Liars

conectar no chat gpt passando um tema e ele inventar uma mentira bem elaborada pra você usar.","2","4","24","0","Sun Jul 16 17:43:19 +0000 2023","1","false","false"
"https://x.com/lalifontanella/status/1680392903460376576","https://twitter.com/lalifontanella/status/1680392903460376576","1680392903460376576","eu sempre dou oi pro chatgpt antes de pergungar","0","0","13","0","Sun Jul 16 01:44:23 +0000 2023","0","false","true"
"https://x.com/Estadao/status/1680513855347097604","https://twitter.com/Estadao/status/1680513855347097604","1680513855347097604","ChatGPT vive à sombra de um grande escândalo de dados; entenda (via @EstadaoLink)
https://t.co/LpyJ0wPz2C","3","1","7","0","Sun Jul 16 09:45:00 +0000 2023","3","false","false"
"https://x.com/lanlico/status/1680712636193816577","https://twitter.com/lanlico/status/1680712636193816577","1680712636193816577","@fatosdabolsa Se quiser assistir em vídeo de graça tbm é só ir na playlist dele. Tem tudo lá. Se não souber inglês, baixa a descrição  do vídeo todo em inglês e manda o ChatGPT traduzir tudo e vai acompanhando. 

https://t.co/Wm5ihAKlGQ","0","1","11","0","Sun Jul 16 22:54:53 +0000 2023","3","false","false"
"https://x.com/1lucabelli/status/1680564194477735938","https://twitter.com/1lucabelli/status/1680564194477735938","1680564194477735938","Elaborei mais sobre o assunto nesta matéria no @JotaInfo explicando ""Por que o #ChatGPT descumpre a LGPD e por que peticionei à ANPD""
https://t.co/kWH3ST5OtB","1","1","3","0","Sun Jul 16 13:05:01 +0000 2023","0","false","false"
"https://x.com/BlockTrendsBR/status/1680684479848005633","https://twitter.com/BlockTrendsBR/status/1680684479848005633","1680684479848005633","Destaques da semana:

Bard chega ao Brasil. Mas afinal, quais são as principais diferenças entre o Bard e o ChatGPT? Listamos as 4 principais!
https://t.co/CblOewRwKD","2","1","5","0","Sun Jul 16 21:03:00 +0000 2023","0","false","false"
"https://x.com/fjviegas/status/1680683490658996226","https://twitter.com/fjviegas/status/1680683490658996226","1680683490658996226","É interessante. Quando apareceram os primeiros dossiers de imprensa sobre AI em geral e ChatGPT, a “imprensa de referência” tratou-a como um novo gadget, “que coisa tão gira, parece um microondas”. Hollywood está a recolocar a AI no centro do debate.","0","11","47","1","Sun Jul 16 20:59:04 +0000 2023","0","false","false"
"https://x.com/mellocomdoisele/status/1680526686889050112","https://twitter.com/mellocomdoisele/status/1680526686889050112","1680526686889050112","Acho que se eu fosse uma roteirista de greve em Hollywood eu ia argumentar assim: ""tá achando ruim? Contrata o chatgpt!""","0","0","5","0","Sun Jul 16 10:35:59 +0000 2023","0","false","false"
"https://x.com/rdfmedeiros/status/1680624056054296577","https://twitter.com/rdfmedeiros/status/1680624056054296577","1680624056054296577","@bbpv_liberty Pedi a descrição no ChatGPT e coloquei no Midjourney, especificando que tinha que ser uma foto feita com uma Kodak Portra 400","29","27","3386","4","Sun Jul 16 17:02:54 +0000 2023","959","false","false"
"https://x.com/paulo_avante10/status/1680381838567653378","https://twitter.com/paulo_avante10/status/1680381838567653378","1680381838567653378","Nessa semana, totalizou, somando as madrugadas de tentativa e erro e muita pesquisa, tudo 100% no tato, mais de
24 horas
de tentativas para arrumar o bug do meu APP Swift.
Acabei de cons_eguir!!
ChatGPT não conseguia me ajudar, já que a causa é nova.

https://t.co/2sg9YPLe8q","0","1","5","0","Sun Jul 16 01:00:24 +0000 2023","0","false","false"
"https://x.com/claudiopozas/status/1680582582344220673","https://twitter.com/claudiopozas/status/1680582582344220673","1680582582344220673","Artigo com lista de livros recomendados... mas os livros não existem! Suspeita-se de que tenha rolado um ChatGPT aí.

@NatuzaNery @MarceloLins68 @arthurdapieve @rosana","1","0","4","0","Sun Jul 16 14:18:06 +0000 2023","0","false","true"
"https://x.com/snowtinn/status/1680637235001958400","https://twitter.com/snowtinn/status/1680637235001958400","1680637235001958400","O GEMINI TÍMIDO E O FOURTH TODO ATENCIOSO AJEKWJEKWKEKEKSK TEM COISAS QUE-","1","0","5","0","Sun Jul 16 17:55:16 +0000 2023","0","false","true"
"https://x.com/zhbinz/status/1680633076198645762","https://twitter.com/zhbinz/status/1680633076198645762","1680633076198645762","que engraçadinhos o fourth falando que não é nada e o gemini quase desmaiando de vergonha SERIOO","0","0","0","0","Sun Jul 16 17:38:44 +0000 2023","0","false","true"
"https://x.com/tamagolorelei/status/1680604167319040000","https://twitter.com/tamagolorelei/status/1680604167319040000","1680604167319040000","@gemini_ink a cada tweet do af fico mais triste de não ter ido kkkkrying 🫠🫠🫠","0","1","2","0","Sun Jul 16 15:43:52 +0000 2023","0","false","false"
"https://x.com/Fraaaaaanp/status/1680666868279902216","https://twitter.com/Fraaaaaanp/status/1680666868279902216","1680666868279902216","Geminis a la libertadores VAMOSSS","0","0","1","0","Sun Jul 16 19:53:01 +0000 2023","0","false","true"
"https://x.com/jackesart/status/1680612316423782400","https://twitter.com/jackesart/status/1680612316423782400","1680612316423782400","@gemini_ink Que TENTAÇÃO!!! 😭😭😭😭","0","1","1","0","Sun Jul 16 16:16:15 +0000 2023","0","false","false"
"https://x.com/EsZannoni/status/1680724726207991810","https://twitter.com/EsZannoni/status/1680724726207991810","1680724726207991810","@juanpedr0c Geminis","0","0","1","0","Sun Jul 16 23:42:55 +0000 2023","0","false","false"
"https://x.com/soluvius/status/1680605818704609280","https://twitter.com/soluvius/status/1680605818704609280","1680605818704609280","@gemini_ink Isso são as fantasias de Sakuda????","0","1","2","0","Sun Jul 16 15:50:25 +0000 2023","0","false","false"
"https://x.com/Kuuhaku_sama90/status/1680628790026805250","https://twitter.com/Kuuhaku_sama90/status/1680628790026805250","1680628790026805250","@Ladyshiba_cos @taobunny_ @mibune @kyox @kakuchosgirl @maanjirobtw @moonexra10213 @rinddx @miss_nothiing_ @gemini_ink @santoscosphoto @GincaTokyoRv @julebsj @senjwu_ @Natsuki54370751 @Naomiilysanzu Kyaaaaaaaaaaaa acabei de chegar e sentei na janela kakaka","0","0","4","0","Sun Jul 16 17:21:42 +0000 2023","0","false","false"
"https://x.com/Danygentilucci/status/1680705461052403713","https://twitter.com/Danygentilucci/status/1680705461052403713","1680705461052403713","@geminis_hn Amo ser del signo Geminis... 🤙","0","0","1","0","Sun Jul 16 22:26:22 +0000 2023","0","false","false"
"https://x.com/maannjiroo/status/1680627305494765568","https://twitter.com/maannjiroo/status/1680627305494765568","1680627305494765568","@Ladyshiba_cos @taobunny_ @mibune @kyox @kakuchosgirl @moonexra10213 @rinddx @miss_nothiing_ @gemini_ink @santoscosphoto @GincaTokyoRv @julebsj @senjwu_ @Natsuki54370751 @Naomiilysanzu @Kuuhaku_sama90 Euuuuu ai gnt meu coracao","0","1","2","0","Sun Jul 16 17:15:48 +0000 2023","0","false","false"
"https://x.com/eumaxwilliann/status/1680575792919478277","https://twitter.com/eumaxwilliann/status/1680575792919478277","1680575792919478277","@gemini_ink Eu já gastei td nas da hello kitty!!","0","1","1","0","Sun Jul 16 13:51:07 +0000 2023","0","false","false"
"https://x.com/deadpr1nt/status/1680531650311069698","https://twitter.com/deadpr1nt/status/1680531650311069698","1680531650311069698","@ilustragus @SUKANNE @gemini_ink UM CARA QUERIA COMPRAR MEU BANNER ONTEM KKKKKKKK","0","1","2","0","Sun Jul 16 10:55:42 +0000 2023","0","false","false"
