"url","twitterUrl","id","text","retweetCount","replyCount","likeCount","quoteCount","createdAt","bookmarkCount","isRetweet","isQuote"
"https://x.com/mu_giwaras/status/1680690181983162368","https://twitter.com/mu_giwaras/status/1680690181983162368","1680690181983162368","por fim, mas não menos importante. tava tudo muito lindo queria comprar tudo de todo mundo 😭😭

@gemini_ink @3ndjuice @ilustraluly @MsBunnat @reborn_neo_art @ko_rachi https://t.co/87JEYCmNxy","2","3","9","0","Sun Jul 16 21:25:39 +0000 2023","0","false","false"
"https://x.com/oberonjun/status/1680647471133782016","https://twitter.com/oberonjun/status/1680647471133782016","1680647471133782016","prova de que o gemini é bom em tudo: beijou pela primeira vez com o fourth e desde então o menino vive doido por qualquer oportunidade pra beijar ele de novo","8","1","30","1","Sun Jul 16 18:35:56 +0000 2023","1","false","false"
"https://x.com/neeyumi/status/1680399881557385217","https://twitter.com/neeyumi/status/1680399881557385217","1680399881557385217","Eu não estava mentindo quando eu disse que fiz a limpa no Artist Alley 🤭🤭🤭🤭🤭

Alguns artista que estão aí: @bananamisart @kaokki @yasmin_art @Mochironmochi_ @_hoshyuu @ChaDeEstrelas @gemini_ink @ilustracici @biifolio @Wiushio @Delamorart @_thamirissoares ♥️ https://t.co/sUH5fxfnzU","6","3","40","1","Sun Jul 16 02:12:06 +0000 2023","2","false","false"
"https://x.com/riko_kfannya/status/1680672412524847112","https://twitter.com/riko_kfannya/status/1680672412524847112","1680672412524847112","O Gemini e Fourth sendo o motivo do meu colapso https://t.co/PnlvKFBH3O","0","1","1","0","Sun Jul 16 20:15:03 +0000 2023","0","false","false"
"https://x.com/pequidog/status/1680377154897432576","https://twitter.com/pequidog/status/1680377154897432576","1680377154897432576","Sou freguesa assídua da @gemini_ink! Completei minha coleção de stickers e e agora eu tenho licença para ser horny com meus chaveiros! !! 💖💖🥺🥺 ((obrigada pelo caderno amiga, eu prometo &gt;&gt;&gt;nunca&lt;&lt;&lt; usar ele de tão lindo que é!)) https://t.co/SUwdvjRi13","1","2","10","0","Sun Jul 16 00:41:48 +0000 2023","0","false","false"
"https://x.com/TheRealBossNay/status/1680696962776027137","https://twitter.com/TheRealBossNay/status/1680696962776027137","1680696962776027137","Gemini fasho 🤣🤣","1","0","1","0","Sun Jul 16 21:52:36 +0000 2023","0","false","true"
"https://x.com/alicastro_09/status/1680719175398961153","https://twitter.com/alicastro_09/status/1680719175398961153","1680719175398961153","pov: sos de geminis https://t.co/5sLLXts13S","0","0","1","0","Sun Jul 16 23:20:52 +0000 2023","0","false","false"
"https://x.com/myngibf/status/1680669348275404800","https://twitter.com/myngibf/status/1680669348275404800","1680669348275404800","o fourth falando que não era nada e o gemini abraçando ele dps pq ficou c vergonha😭😭😭 eles vão me matar juro https://t.co/0liExsTAlR","0","0","0","0","Sun Jul 16 20:02:52 +0000 2023","0","false","false"
"https://x.com/Hike_16/status/1680681896630448128","https://twitter.com/Hike_16/status/1680681896630448128","1680681896630448128","@perthsea SUSTENTA GEMINI CORRE N!!! o Fourth pego d surpresaaaa 
@blindfireflies https://t.co/VtdRSW4Ucn","0","1","3","0","Sun Jul 16 20:52:44 +0000 2023","0","false","false"
"https://x.com/Dnanana41/status/1680628796225998849","https://twitter.com/Dnanana41/status/1680628796225998849","1680628796225998849","O gemini ficando tímido depois do beijo. Eu morro","2","0","16","0","Sun Jul 16 17:21:44 +0000 2023","0","false","true"
"https://x.com/GeminiFourthBR/status/1680728442562543618","https://twitter.com/GeminiFourthBR/status/1680728442562543618","1680728442562543618","📸 IG • Atualização de p_putzaka

16.07.2023

[#geminint #gemini_nt #fourthig #fourthnattawat #geminifourth #gmmtv #DestinyclinicxGF] https://t.co/mLUEw49414","1","1","20","1","Sun Jul 16 23:57:41 +0000 2023","1","false","false"
"https://x.com/tinnguny/status/1680638488583045124","https://twitter.com/tinnguny/status/1680638488583045124","1680638488583045124","fourth vc deixaria eu dar uns beijinhos no gemini tbm ein deixaria vc","1","1","7","0","Sun Jul 16 18:00:15 +0000 2023","0","false","false"
"https://x.com/lesbica20426677/status/1680632904580317184","https://twitter.com/lesbica20426677/status/1680632904580317184","1680632904580317184","@perthsea GEMINI DO CÉU VOCE NAO TINHA ESSE DIREITO! EU TO CHOCADA PASSADA QUE ISSO GENTE? QUE SABOR PQP https://t.co/6OQuqw2X0o","1","1","7","0","Sun Jul 16 17:38:03 +0000 2023","1","false","false"
"https://x.com/oberonjun/status/1680646627839623176","https://twitter.com/oberonjun/status/1680646627839623176","1680646627839623176","n swi quem eh mais viado o gemini com essa brincadeirinha ou o fourth quem nem reage só quer beijo","0","0","3","0","Sun Jul 16 18:32:35 +0000 2023","0","false","true"
"https://x.com/aurium/status/1680377439292207112","https://twitter.com/aurium/status/1680377439292207112","1680377439292207112","Almost hurts to crush a 2-10-11-3 neural network code to 1024 bytes!

Quase dói esmagar um código de rede neural 2-10-11-3 para 1024 bytes!

#JS #ANN @js1024fun https://t.co/D7wsJdpNs7 https://t.co/C28UvOYkUf","0","1","2","0","Sun Jul 16 00:42:56 +0000 2023","1","false","false"
"https://x.com/PistoLaura_/status/1680723792014843912","https://twitter.com/PistoLaura_/status/1680723792014843912","1680723792014843912","Quando eu ia pra Itaquera de metrô era assim","0","0","2","0","Sun Jul 16 23:39:13 +0000 2023","0","false","true"
"https://x.com/wanexinha_/status/1680720669804306432","https://twitter.com/wanexinha_/status/1680720669804306432","1680720669804306432","Dred…não sei Yh 
Eu não ia conseguir reagir, ia só bazar.","1","0","4","0","Sun Jul 16 23:26:48 +0000 2023","0","false","true"
"https://x.com/coolftsmmr/status/1680725271425478656","https://twitter.com/coolftsmmr/status/1680725271425478656","1680725271425478656","minha filha se fosse no brasil voce ia descer dai de um jeito ou de outro","0","3","3","0","Sun Jul 16 23:45:05 +0000 2023","0","false","true"
"https://x.com/arthurs_novaes/status/1680728416977297409","https://twitter.com/arthurs_novaes/status/1680728416977297409","1680728416977297409","Uma IA fiel aos tweets do seu muso inspirador. Impossível distinguir um do outro","0","0","3","0","Sun Jul 16 23:57:35 +0000 2023","0","false","true"
"https://x.com/dutraviv/status/1680724319175946240","https://twitter.com/dutraviv/status/1680724319175946240","1680724319175946240","minha mãe me chamou no cantinho flnd que não avisei ela que ia sair ontem ai eu: po vdd errei fui moleca
ai ela: filha, tenta não errar mais, você tá errando muito ultimamente 
KKKKKKKKKKKKKKKKKKKKKKKKKK","0","1","5","0","Sun Jul 16 23:41:18 +0000 2023","0","false","false"
"https://x.com/RaphaMarquesCRF/status/1680723587387256832","https://twitter.com/RaphaMarquesCRF/status/1680723587387256832","1680723587387256832","@futebol_info @OGlobo_Esportes @mneves_ Técnico da cbf po, quem ia ser expulso? Kkk","9","0","432","0","Sun Jul 16 23:38:24 +0000 2023","0","false","false"
"https://x.com/theboshe/status/1680721768636379137","https://twitter.com/theboshe/status/1680721768636379137","1680721768636379137","@gustavodarossi @_rafeeel @marcusramone @ivanrezende13 aquele q você ia passar comigo e não foi junto em nenhum rolê? https://t.co/I3Jm27cnpE","0","1","5","0","Sun Jul 16 23:31:10 +0000 2023","0","false","false"
"https://x.com/lcstizz/status/1680728980968841217","https://twitter.com/lcstizz/status/1680728980968841217","1680728980968841217","e esse dia que fomos trollados achando que a reina ia voltar com tudo e morreu ali mesmo?","2","0","2","0","Sun Jul 16 23:59:50 +0000 2023","0","false","true"
"https://x.com/oscar_ichigo/status/1680721690089668608","https://twitter.com/oscar_ichigo/status/1680721690089668608","1680721690089668608","Tulin aqui em Belém ia fritar desse jeito aqui hahaha 🐔🤣","0","0","6","0","Sun Jul 16 23:30:51 +0000 2023","0","false","true"
"https://x.com/_Dudu_2602/status/1680722088808652800","https://twitter.com/_Dudu_2602/status/1680722088808652800","1680722088808652800","@paposfut Porra, tu tava falando que o cara ia fracassar na carreira e virar uber, meio diferente que zuar no futebol","0","4","78","0","Sun Jul 16 23:32:26 +0000 2023","0","false","false"
"https://x.com/BELIEBERZLUXO/status/1680727384729739264","https://twitter.com/BELIEBERZLUXO/status/1680727384729739264","1680727384729739264","achei que nunca mais ia ver a kylie e a jordyn juntas","0","0","4","0","Sun Jul 16 23:53:29 +0000 2023","0","false","false"
"https://x.com/heypdro/status/1680727029837189120","https://twitter.com/heypdro/status/1680727029837189120","1680727029837189120","ontem apareceu o batalhão de operações especiais com fuzil na mão dizendo que as pessoas não poderiam ficar na calçada ali no skibar e o joka sabendo que eu ia querer discutir com eles e usar ele como meu escudo (meu advogado branco) sumiu kkkkkk","0","4","25","0","Sun Jul 16 23:52:04 +0000 2023","0","false","false"
"https://x.com/vulgovillamix/status/1680721981098827777","https://twitter.com/vulgovillamix/status/1680721981098827777","1680721981098827777","Cheguei em Piedade achando que minha irmã ia me levar fazer alguma coisa (como a boa adolescente que é) e vou ficar em casa ??????????","0","2","23","0","Sun Jul 16 23:32:01 +0000 2023","0","false","false"
"https://x.com/TriSertanejo/status/1680727402924634112","https://twitter.com/TriSertanejo/status/1680727402924634112","1680727402924634112","ABRIL. Em abril, já era claro que isso ia acontecer. Amadores!","0","1","33","0","Sun Jul 16 23:53:33 +0000 2023","0","false","true"
"https://x.com/Alencar80Amanda/status/1680721299012763649","https://twitter.com/Alencar80Amanda/status/1680721299012763649","1680721299012763649","Ia pedir Ifood, ia comprar ingresso para o samba-sábado que vem… Lembrei da fortuna que gastei, desse mês e meio p cá… Fiz um hambúrguer e, semana que vem, ouço samba em casa! Gezuiz! 🤦🏻‍♀️","0","0","6","0","Sun Jul 16 23:29:18 +0000 2023","0","false","false"
"https://x.com/n0patino/status/1680724882542284800","https://twitter.com/n0patino/status/1680724882542284800","1680724882542284800","Lana de Rey e bad bunny no mm dia…. Eu ia tanto desmaiar","0","0","5","0","Sun Jul 16 23:43:33 +0000 2023","0","false","true"
"https://x.com/pretafrodite/status/1680728740639256576","https://twitter.com/pretafrodite/status/1680728740639256576","1680728740639256576","antes eu ficava nervosa quando ia para um date, mas agora eu simplesmente amo porque sei que sou divertida, legal, interessante e engraçadinha, e que a pessoa sempre acaba me adorando e querendo bis","0","0","7","0","Sun Jul 16 23:58:52 +0000 2023","0","false","false"
"https://x.com/layserdrgs/status/1680724475095007232","https://twitter.com/layserdrgs/status/1680724475095007232","1680724475095007232","ne mana ja enganei ladrão armado la no guama ia bem perder pra essas tonha","0","1","3","0","Sun Jul 16 23:41:55 +0000 2023","0","false","true"
"https://x.com/ygorpalopoli/status/1680723081227059200","https://twitter.com/ygorpalopoli/status/1680723081227059200","1680723081227059200","@FloraAndrad tem IA envolvida https://t.co/D7mGduXu4U","0","1","7","0","Sun Jul 16 23:36:23 +0000 2023","0","false","false"
"https://x.com/brunavvaz/status/1680722229934391297","https://twitter.com/brunavvaz/status/1680722229934391297","1680722229934391297","as replies aqui me faz torcer pras IA tirar o trabalho dos Devs msm","2","7","63","0","Sun Jul 16 23:33:00 +0000 2023","2","false","true"
"https://x.com/joaobazarov/status/1680653397001641984","https://twitter.com/joaobazarov/status/1680653397001641984","1680653397001641984","Impressionante. Perdi uma discussão por causa do chatgpt https://t.co/FangX3Zn2B","1","1","2","0","Sun Jul 16 18:59:29 +0000 2023","0","false","false"
"https://x.com/brisando__owl/status/1680679491079659525","https://twitter.com/brisando__owl/status/1680679491079659525","1680679491079659525","E é assim senhoras e senhores que eu aprendo sobre o assunto, obrigada chatgpt, você é uma teacher 🥹 https://t.co/3MScvUnPrr","0","1","3","0","Sun Jul 16 20:43:10 +0000 2023","0","false","false"
"https://x.com/gestordeobras/status/1680604451852222466","https://twitter.com/gestordeobras/status/1680604451852222466","1680604451852222466","Construindo análises de arquivos de engenharia, arquitetura e construção com ChatGPT, Python e Excel https://t.co/3EFHRTDT1e https://t.co/REfuuNm939","0","0","0","0","Sun Jul 16 15:45:00 +0000 2023","0","false","false"
"https://x.com/ofertaamazonbr/status/1680724615444799488","https://twitter.com/ofertaamazonbr/status/1680724615444799488","1680724615444799488","CONHEÇA O GOOGLE BARD - MAIS NOVO COMPETIDOR DO CHATGPT E BING

1/6 - O Bard é uma ferramenta de inteligência artificial do Google que utiliza um modelo de linguagem de processamento de texto para ajudar na criação de conteúdos escritos. https://t.co/NxApkuRXYI","0","1","1","0","Sun Jul 16 23:42:29 +0000 2023","0","false","false"
"https://x.com/R1CR1K/status/1680722386008539136","https://twitter.com/R1CR1K/status/1680722386008539136","1680722386008539136","Pedi pro ChatGPT analisar meu Soneto, e passa exatamente a mensagem que eu queria, fiz esse Soneto porque meu professor de português falou que eu não conseguiria fazer um Soneto e passar a mensagem que eu desejaria. https://t.co/xPsLaZiPvB","0","0","1","0","Sun Jul 16 23:33:37 +0000 2023","0","false","false"
"https://x.com/andre_lug/status/1680606670429507585","https://twitter.com/andre_lug/status/1680606670429507585","1680606670429507585","Esse é o melhor prompt para o ChatGPT e funciona para qualquer cenário.

#ia #chatgpt #inteligenciaartificial #chatgptprompts https://t.co/ED1dHDB7YP","0","3","1","0","Sun Jul 16 15:53:49 +0000 2023","2","false","false"
"https://x.com/_market_Insider/status/1680627990256918534","https://twitter.com/_market_Insider/status/1680627990256918534","1680627990256918534","ChatGPT perde usuários, tecnologia centenária viraliza e brasileiros podem receber até R$ 2.464; entenda https://t.co/xEF4L5lUrS https://t.co/RlgyHoWuPU","0","1","0","0","Sun Jul 16 17:18:32 +0000 2023","0","false","false"
"https://x.com/bielucker/status/1680703593886760960","https://twitter.com/bielucker/status/1680703593886760960","1680703593886760960","Lá vai uma dica: ChatGPT salva as suas conversas, tu não precisa ficar iniciando sempre um novo chat pra pedir uma demanda de tal cliente. 
Abre um chat e nomeia ele com o nome do cliente e algum emoji dele e ai é só ficar alimentando o mesmo chat com as informações dele. https://t.co/A4Amz2iyIe","0","0","0","0","Sun Jul 16 22:18:57 +0000 2023","0","false","false"
"https://x.com/docente_errante/status/1680648439590166528","https://twitter.com/docente_errante/status/1680648439590166528","1680648439590166528","Não sei se o ChatGPT está alucinando ou bem fiel à verdade, mas eu gosto da ideia de feitiçaria dando o nome do morro. O ambiente aqui é realmente muito especial. https://t.co/hi0qlOl7Tq","1","1","3","0","Sun Jul 16 18:39:47 +0000 2023","0","false","false"
"https://x.com/Zigomatico/status/1680629635061620744","https://twitter.com/Zigomatico/status/1680629635061620744","1680629635061620744","Tá, me deixa que eu e o Chat GPT temos que escrever um artigo agora!","0","0","5","0","Sun Jul 16 17:25:04 +0000 2023","0","false","false"
"https://x.com/ciloz/status/1680727901065338880","https://twitter.com/ciloz/status/1680727901065338880","1680727901065338880","Bronca de quem aciona o reply GPT para responder a postagens 🤦‍♂️. O cara tem tanta preguiça mental que é incapaz de formular uma frase na cabeça, quanto mais escrever a bendita frase. Retardados é o mínimo que são. #replygpt #chatgpt","0","2","1","0","Sun Jul 16 23:55:32 +0000 2023","0","false","false"
"https://x.com/mechamadere/status/1680624270714478594","https://twitter.com/mechamadere/status/1680624270714478594","1680624270714478594","Depois que eu aprendi (ainda tô aprendendo a mexer com chatgpt tem sido uma mão na roda pra mim em muita coisa.","0","1","0","0","Sun Jul 16 17:03:45 +0000 2023","0","false","false"
"https://x.com/milebinha/status/1680686623468539904","https://twitter.com/milebinha/status/1680686623468539904","1680686623468539904","os salvos do google chrome do ari eh tipo
-chat gpt
-anuario estatistico
-campo minado
-estagios fflch
-tesouro direto
-dominio drag","1","0","3","0","Sun Jul 16 21:11:31 +0000 2023","0","false","false"
"https://x.com/thebicente/status/1680655685195911168","https://twitter.com/thebicente/status/1680655685195911168","1680655685195911168","a minha mae ta a fazer o trabalho dela no chatgpt………","0","1","1","0","Sun Jul 16 19:08:35 +0000 2023","0","false","false"
"https://x.com/Nespty/status/1680619726269980672","https://twitter.com/Nespty/status/1680619726269980672","1680619726269980672","Chatgpt erra até regra de sinal em expressão numérica simples kkkkk","0","2","2","0","Sun Jul 16 16:45:41 +0000 2023","0","false","false"
"https://x.com/rvsuhett/status/1680710910053175296","https://twitter.com/rvsuhett/status/1680710910053175296","1680710910053175296","caralho pedi nome pra gato cinza do olho azul pro chatgpt e só nome pica que isso filho","0","1","1","0","Sun Jul 16 22:48:01 +0000 2023","0","false","false"
"https://x.com/prbandetini/status/1680685273347227651","https://twitter.com/prbandetini/status/1680685273347227651","1680685273347227651","melhor jeito de ver filme, é pegar uma música que tu gosta e falar pro chatgpt te dar filmes com a vibe da música… erra nunca","0","0","2","0","Sun Jul 16 21:06:09 +0000 2023","0","false","false"
"https://x.com/camaavinga/status/1680626462305419266","https://twitter.com/camaavinga/status/1680626462305419266","1680626462305419266","mandei o trabalho todo resumido no chatgpt ou com citação direta eu tenho certeza q ela vai me reprovar já n gosta de mim mesmo","0","0","1","0","Sun Jul 16 17:12:27 +0000 2023","0","false","false"
"https://x.com/sobreira_ale/status/1680641843413876736","https://twitter.com/sobreira_ale/status/1680641843413876736","1680641843413876736","será que meus amigo que usa chat gpt tão carente","0","0","0","0","Sun Jul 16 18:13:34 +0000 2023","0","false","false"
"https://x.com/taveirasof/status/1680608126855270400","https://twitter.com/taveirasof/status/1680608126855270400","1680608126855270400","ChatGPT eu te amo cara 🫶🏼","0","0","0","0","Sun Jul 16 15:59:36 +0000 2023","0","false","false"
"https://x.com/rekiviado/status/1680639332997103618","https://twitter.com/rekiviado/status/1680639332997103618","1680639332997103618","o fato do gemini se sentir tão confortável com o fourth que até no beijo deles ele faz brincadeira ai que inferno eu amo eles demais","1","2","1","2","Sun Jul 16 18:03:36 +0000 2023","0","false","false"
"https://x.com/rekiviado/status/1680631948278915073","https://twitter.com/rekiviado/status/1680631948278915073","1680631948278915073","o fourth esperou tanto pra beijar o gemini que deve ter soltado fogos de artifício quando conseguiu","2","1","2","1","Sun Jul 16 17:34:15 +0000 2023","1","false","false"
"https://x.com/samiamora_hyuck/status/1680681824287092739","https://twitter.com/samiamora_hyuck/status/1680681824287092739","1680681824287092739","MDS EU TÔ INDO DE SUBMARINO
caras o gemini manooooo","1","0","2","0","Sun Jul 16 20:52:27 +0000 2023","0","false","true"
"https://x.com/DeniseCorrea85/status/1680631502583767042","https://twitter.com/DeniseCorrea85/status/1680631502583767042","1680631502583767042","Esse vídeo tem tantas camadas... o Nanon que olha quando o Gemini vai para o lado do Ohm, mas disfarça, o G tentando levantar a camiseta do O que não deixa, o N passando entre eles separando os dois e o O que se afasta do G e fala alguma coisa para um N nada feliz...
#OhmNanon","0","0","4","0","Sun Jul 16 17:32:29 +0000 2023","1","false","true"
"https://x.com/icouprang/status/1680653860031938562","https://twitter.com/icouprang/status/1680653860031938562","1680653860031938562","acho que esses edit foi a pledis chegando neles e ""vcs vão fazer os próprios post de aniversário no twitter 😃"" 

ai os gemini ""po não vou ter tempo"" 
e a pledis ""ah é? pois então quem vai fazer vai ser a afilhada do chefe"" ai saiu essa coisa aí","0","0","0","0","Sun Jul 16 19:01:19 +0000 2023","0","false","true"
"https://x.com/carefreemaroon/status/1680441896102166528","https://twitter.com/carefreemaroon/status/1680441896102166528","1680441896102166528","Gemini, Aquarius, Virgo","0","0","1","0","Sun Jul 16 04:59:03 +0000 2023","0","false","true"
"https://x.com/tinasemedo98/status/1680649831767736321","https://twitter.com/tinasemedo98/status/1680649831767736321","1680649831767736321","Não entendi ele falando não mais se ajeitando na cama, Gemini você não me engana tava querendo mas tava morrendo de vergonha tadinho 😂😂","0","1","1","0","Sun Jul 16 18:45:19 +0000 2023","0","false","true"
"https://x.com/gemfothv/status/1680629580154167298","https://twitter.com/gemfothv/status/1680629580154167298","1680629580154167298","NÃO TANK9 O FOURTH COM O SORRISO DO TAMANHO DO MUNDO TODA VEZ QUE VAI BEIJAR O GEMINI https://t.co/AzDLRIkbtQ","0","0","8","0","Sun Jul 16 17:24:51 +0000 2023","0","false","false"
"https://x.com/HopPeaMelon/status/1680456738523451397","https://twitter.com/HopPeaMelon/status/1680456738523451397","1680456738523451397","correct sa gemini","0","0","5","1","Sun Jul 16 05:58:02 +0000 2023","1","false","true"
"https://x.com/Ladyshiba_cos/status/1680626649270722560","https://twitter.com/Ladyshiba_cos/status/1680626649270722560","1680626649270722560","Qual seu top 18 pessoas favs do twitter? Meu:
@taobunny_ 
@mibune 
@kyox 
@kakuchosgirl 
@maanjirobtw 
@moonexra10213 
@rinddx 
@miss_nothiing_ 
@gemini_ink 
@santoscosphoto 
@GincaTokyoRv 
@julebsj 
@senjwu_ 
@Natsuki54370751 
@Naomiilysanzu 
@Kuuhaku_sama90 
Não deu os 18 HAHAH","1","10","9","0","Sun Jul 16 17:13:12 +0000 2023","0","false","true"
"https://x.com/FavsHildegard/status/1680697167000764417","https://twitter.com/FavsHildegard/status/1680697167000764417","1680697167000764417","Prender o Kai em 1903 ta no top maiores burrices dessa série além de ser o líder da convenção gemini, é dito que o ascendente não viaja entre o mundo Real e o prisão e destruir o ascendente não ia funcionar então era bem óbvio que não ia funcionar e ele ia escapar","0","1","0","0","Sun Jul 16 21:53:25 +0000 2023","0","false","true"
"https://x.com/geminibgf/status/1680672278516727809","https://twitter.com/geminibgf/status/1680672278516727809","1680672278516727809","nunca. nunca vai sair da minha cabeça o gemini tímido depois de beijar NUNCA","0","2","5","0","Sun Jul 16 20:14:31 +0000 2023","0","false","false"
"https://x.com/evakparallelx/status/1680679710001442819","https://twitter.com/evakparallelx/status/1680679710001442819","1680679710001442819","o gemini e mesmo o omega do fourth me impressiono","2","1","6","0","Sun Jul 16 20:44:03 +0000 2023","0","false","true"
"https://x.com/deh_2728/status/1680619082066935808","https://twitter.com/deh_2728/status/1680619082066935808","1680619082066935808","Quem é esse e o que ele fez com o Gemini? Esse menino fez 19 anos e começou a ficar todo ousado @desenhomoderno2","0","1","2","0","Sun Jul 16 16:43:08 +0000 2023","0","false","true"
"https://x.com/meowonoo/status/1680376615589621760","https://twitter.com/meowonoo/status/1680376615589621760","1680376615589621760","capricorn 🤝🏻 gemini
falando mal de tudo e de todos","0","0","1","0","Sun Jul 16 00:39:39 +0000 2023","0","false","true"
"https://x.com/GustarLight_/status/1680728200870088704","https://twitter.com/GustarLight_/status/1680728200870088704","1680728200870088704","@gemini_ink AAAA MEU SONHO 🥺🥺🥺, QUE COISA MAIS LINDA GEM!!!","0","1","1","0","Sun Jul 16 23:56:44 +0000 2023","0","false","false"
"https://x.com/medaunstiro/status/1680650591259721728","https://twitter.com/medaunstiro/status/1680650591259721728","1680650591259721728","véi entrei no banheiro do shopping e assim q eu entro na cabine tá tocando CLUB INST THE BEST PLACE TO FIND LOVE SO THE BAR IS WHERE I GO e eu me gaitei de rir lembrando DAQULE vídeo do gemini","0","2","0","0","Sun Jul 16 18:48:20 +0000 2023","1","false","false"
"https://x.com/heli_hukori/status/1680720271928434688","https://twitter.com/heli_hukori/status/1680720271928434688","1680720271928434688","@gemini_ink Ainda bem que peguei no primeiro dia do AF kkkk
Parabéns pelo sucesso!!!","0","1","1","0","Sun Jul 16 23:25:13 +0000 2023","0","false","false"
"https://x.com/gemini_ink/status/1680545184214286336","https://twitter.com/gemini_ink/status/1680545184214286336","1680545184214286336","Aliás, entre hoje e amanhã eu responderei todas as menções e DMs, prometo! 🩷🩷","0","0","9","0","Sun Jul 16 11:49:29 +0000 2023","0","false","true"
"https://x.com/vine_o_gemini/status/1680416792563396608","https://twitter.com/vine_o_gemini/status/1680416792563396608","1680416792563396608","@paulinhathaais Meu Deus mulher","0","0","1","0","Sun Jul 16 03:19:18 +0000 2023","0","false","false"
"https://x.com/UOLNoticias/status/1680564549588590592","https://twitter.com/UOLNoticias/status/1680564549588590592","1680564549588590592","🛜 Drone que colhe maçãs com inteligência artificial é usado no Chile

🍎 A iniciativa foi adotada para lidar com a falta de mão de obra https://t.co/ajMaqNzjVT","13","17","203","22","Sun Jul 16 13:06:26 +0000 2023","9","false","false"
"https://x.com/vanderson_vsn/status/1680672759381106691","https://twitter.com/vanderson_vsn/status/1680672759381106691","1680672759381106691","Inteligência Artificial na Bahia! https://t.co/SgWvRfKG9K","0","4","227","1","Sun Jul 16 20:16:25 +0000 2023","0","false","false"
